comment_id,comment,likeCount,video_id
Ugz33tJiRuFCjCWu8NB4AaABAg,6:40 메딕 둘이 시팅해주는거졸라웃기네 ㅋㅋㅋ,9,u-Fq2uAgVfo
UgzNw0N5fyif1U-sSQ54AaABAg,지환이는 롤 안할때 왤캐 행복해보이냐,275,u-Fq2uAgVfo
Ugwial810YmNrIMnnxd4AaABAg,아 물쥐 그마가는거 진짜 보고싶엇는데 연패중인거 슬프다,15,u-Fq2uAgVfo
UgxnUZqVSq_-oTC9F494AaABAg,아니 괴물쥐는 롤뿐만이 아니라 산악회 타게임 전부 ㅈ나 재미있네ㅋㅋㅋ,1,u-Fq2uAgVfo
UgyXAAqJNb7hKZXmO-14AaABAg,캐리비안 괴물쥐 폼 미쳤다 ㄷ,4,u-Fq2uAgVfo
Ugx5Z2vLAvJiSlKyLWd4AaABAg,코익분대장 폼 미쳤고,2,u-Fq2uAgVfo
UgwLLK6X7CICFICqfL14AaABAg,"제일 좋아하는 유튜버가 형인데 
발로란트나 롤이나 영상보면
다 좋다 요즘 게임도 보면 거의
이기는 판이고 게임 스트레스로
아픈것도 별로 없는거보면 언젠
가는 그마도 곧 찍을 수 있을 거
라고믿어 남은 시즌도 힘내자",729,fNdMRZaCdug
UgzR00wHLZ1Tk9a1arF4AaABAg,4년전에는 지환이형 다2빙하는것만 기다렸는데 이쯤되면 그마가는것도 한번쯤 보고싶다 장지환 파이팅,7,fNdMRZaCdug
UgxJxV-iQzJ0WGfXrAh4AaABAg,지환이 그마가서 라인전부터 한타까지 벽느끼는 모습 보고싶다 ㄹㅇ❤❤,108,fNdMRZaCdug
UgxY27I4jSZVY-qqcyV4AaABAg,다이아갈때까지 열심히 응원할게요! 괴물쥐님 늘 화이팅이에요,111,fNdMRZaCdug
UgzECkjt4md5sr1OxYx4AaABAg,"행복은 목적지가 아니라 여정인 법이지요. 물쥐님이 매일매일 즐거운
여정길이 되었으면 합니다😂",18,fNdMRZaCdug
UgywnqIob3xjhf1EJ5V4AaABAg,모닝빵과 함께 하는 쥐튜브.. 더할 나위 없이 좋다,10,fNdMRZaCdug
UgwMp5ES1RiK5VIsOy54AaABAg,다2빙을 위한 고군분투 열심히 해주세요!!,27,fNdMRZaCdug
Ugw62h6cfy7zC0Ed-1t4AaABAg,진짜 요즘 폼 미쳤다 형 분위기 잘 끌고가서 다이빙 가자!! 화이팅!!!,3,fNdMRZaCdug
Ugw8xlLecC0lzNoimBF4AaABAg,자기전에 쥐튜브 한접시는 하루 피로를 싹 녹여준다 진짜,1,fNdMRZaCdug
Ugx2A3i-TsG0CpWNP194AaABAg,형 진짜 이 점수로도 다이아까지 다시 가면 진짜 그떄는 체념하자..,4,fNdMRZaCdug
UgwnMtRQll0eC2C-oL54AaABAg,"지환이는 질때는 빡쳐하는것도 재밌고
이길때도 콧구멍 벌렁거리면서 텐션 높아지는것도 재밌네 ㅋㅋㅋ",166,1pZBItEgpOs
UgwyT51RnOs4PM8xm254AaABAg,확실히 200점대가니까 팀원들 다 잘하고 보는맛도있다 괴물쥐 흥하자 ㅋㅋ,95,1pZBItEgpOs
UgyuKSzLNmEk29raFiJ4AaABAg,형님 유쾌한 방송에 너무 진지한게 아닌가 싶지만 긍정적인 생각은 긍정적인 결과를 불러옵니다 그마 가는날까지 흐에!!,8,1pZBItEgpOs
UgysxFz_JJAo4IrBnph4AaABAg,"진짜 팀수준이 확 달라진게 느껴짐 ㄹㅇ 눈이
호강이다",3,1pZBItEgpOs
Ugy79agS3Wva26xoM6B4AaABAg,슬쉬 예측 그랩하는 족족 끌리는거보고 감탄했는데 프로였구먼 지환이 폼 미쳤네 ㅋㅋ 남들 생배파서 올릴 때 우직하게 한 계정만 파서 올린 점 멋지다!,197,1pZBItEgpOs
UgzSaZ-HpIiQ8V8i6CR4AaABAg,물쥐형 응원해요 꼭 올라갔으면 좋겠다 모두 응원합니다...,45,1pZBItEgpOs
UgxRe4uZ2nkSPOK7CFJ4AaABAg,확실히 점수 올라가니까 게임 수준이 다르긴 하다.. 물쥐가 그마가서 보여주고 싶어했던 방송이 이런거였구나 화이팅이다 물쥐얌 그마든 다2든 어디든 가봐라 좀 둘다 오지게 재밌겠네,92,1pZBItEgpOs
Ugy_-Q41tPkjWiMiNU14AaABAg,진짜 어디에 가져다 붙여도 잘 어울리는 물쥐의 세숫대야...,208,1pZBItEgpOs
UgwubSVxDtCOBlbervd4AaABAg,쓰레쉬 진짜 개잘하긴하네 ㄹㅇ,138,1pZBItEgpOs
UgxYBMwYOD79ZpWget54AaABAg,"물쥐님 오늘 3년만에 처음으로 목표인 골드 승급했습니다
물쥐님도 이번년도에 원하시는 목표 이루십쇼",1,1pZBItEgpOs
UgxsDvNoqjd-FdByTnx4AaABAg,오늘 영상 진짜 재밌다 시청자들 농담에 웃으면서 화기애애 오랜만에 너무 재밌게 봤어요,286,VrlEmRBdxIg
Ugz8RDXpM-Ak_oay58R4AaABAg,오늘 영상 ㅈㄴ 잘나왔네 ㅋㅋㅋㅋ 평소 괴물쥐 질때 리액션 맛깔나게 다시 잘 티키타카 하는게 왤케 웃기냐 ㅋㅋㅋ,494,VrlEmRBdxIg
UgxpC_GmAH_VNx6RIJx4AaABAg,와 한마디한마디 다 업보로 돌아오는데 관통단하는거 ㅈㄴ웃기네 ㅋㅋㅋㅋㅋㅋㅋㅋㅋㅋㅋㅋㅋ,419,VrlEmRBdxIg
Ugzl4L6BtYfD7nUbZzt4AaABAg,아니 ㅋㅋㅋㅋㅋㅋ 물쥐방 시청자들 확실히 도네 센스가 좋네. 거울치료 ㅋㅋㅋㅋㅋㅋㅋ존나웃김,93,VrlEmRBdxIg
Ugzjas7e8F6deME1WHx4AaABAg,오늘 역대급으로 웃기네 ㅋㅋㅋ 역시 트수들이 스트리머 재밌게 잘패줘야 터짐ㅋㅋㅋ,70,VrlEmRBdxIg
Ugxmm76j-ijze1MXBVp4AaABAg,오늘 특히 더 플레이가 돋보여서 좋았어요 잘생긴 물쥐형😀🙂,0,VrlEmRBdxIg
UgzOkBY_78kOlsFKEb94AaABAg,요즘 물쥐 텐션도 좋고 편집자 폼도 미쳤네 ?,116,VrlEmRBdxIg
UgwPWy8bvi9j2h-VolJ4AaABAg,괴물쥐 롤 영상 보면서 첨으로 박터지게 웃었네 ㄹㅇㅋㅋㅋ,54,VrlEmRBdxIg
Ugx6udHJexjOzMQ_LIR4AaABAg,물쥐 옛날에는 뭐라하면 칼춤인데 요즘은 같이 받아쳐주면서 방송살리는거 왜케 재밌냐 ㅋㅋㅋㅋ,41,VrlEmRBdxIg
Ugy6yyypIuS36vTq8-J4AaABAg,알리 할 때 도네로 사정없이 물어뜯는 거 개욱기네 ㅋㅋㅋㅋ,6,VrlEmRBdxIg
Ugxg437oHMYjPWQu7s54AaABAg,근데 진짜 비원딜할때마다 저 함박웃음 왜이렇게 보기좋냐ㅎㅎ 진짜 행복했으면 좋겠다 :),54,75Eg8XE-6Bo
UgwYh-ySlHqGauVN5UF4AaABAg,드븐을 3년전에 토크온으로 만났는데 그때 챌이었고 연습생하다가 그만뒀다는고만 들었는대 진짜 프로였구나 ..,3,75Eg8XE-6Bo
UgwHUrK5yT7ZaBCOhYx4AaABAg,쥐미라는 진짜 전설이다.. 존나 잘한다..,16,75Eg8XE-6Bo
Ugzviu9er3x0LGGrhEl4AaABAg,괴물쥐 실력은 인정 그래도 바로 피드백하고 현 메타 따라가는건 괴물쥐 빠른듯 이건 진짜 좋게 봐야함,0,75Eg8XE-6Bo
UgzyV_eLQyCw_aXdrVx4AaABAg,코쟁이도 많이 없고 배📷팅이 다들 시원시원해서 조타 📹홀📹카⏱홀⏱카💾n💾e💿t💿,3,75Eg8XE-6Bo
Ugx8me-pe0dhz5iA-IB4AaABAg,오늘 아침 모닝 신라면과 함께 괴물쥐 방송을 보는 나의 삶...하늘은 어둡지만 나의 마음은 밝다...,212,75Eg8XE-6Bo
UgzRw6IFW35b2iLSyGR4AaABAg,"전역 7개월 남았다 물쥐형 덕분에 버틴다,,파견 폰24시간 너무조아,,",20,75Eg8XE-6Bo
Ugw7qXs_cLFR4z_BLVN4AaABAg,원딜 안락사 템 너프 피하고 딜넣기 어쩌구하더니 화면 넘어가자마자 초가스하고 있는거 ㅈㄴ웃음벨이네진짜ㅋㅋㅋㅋㅋㅋ,38,75Eg8XE-6Bo
Ugyyk8-dBkUTnWkQ2Yl4AaABAg,쥐미라 하나면 캐리가 가능한 괴물쥐의 플레이,2,75Eg8XE-6Bo
UgyiHB-4k9yd4gmHtIF4AaABAg,억까는 억까인데 채팅창 한마디 안지고 받아치는거 개웃기네 ㅅㅂㅋㅋ 이게 괴물쥐 참맛이지 ㅋㅋㅋㅋ,0,75Eg8XE-6Bo
UgyLgjxBte5kzdtObZd4AaABAg,"""근데 지환아 넌 모르잖아 그마 가는 세상"" - 더 쥐로리 中",2816,nEjB426cU0k
UgzbGHPXpGYqkdXsdxp4AaABAg,물쥐님 웃는 모습보니깐 저도 행복해지네요 하하하,5,nEjB426cU0k
Ugw4qX-Y5Ut4YQl3Egl4AaABAg,야자 끝나고 오면 괴물쥐 영상 보는게 내삶에 유일한 낙이다,168,nEjB426cU0k
Ugy8UYLGootweVK4jA54AaABAg,괴물쥐 행복해 하는거 보기 좋다,58,nEjB426cU0k
Ugz5z6NNzvQ1Lxb5y5Z4AaABAg,물쥐가 진짜 놀려도 참 반응이 좋아 ㅋㅋㅋㅋㅋㅋ,121,nEjB426cU0k
UgxZmik8cu1nLOlfs7h4AaABAg,편의점 야간시간때 보는 괴물쥐 귀하네 ㅋㅋ,4,nEjB426cU0k
UgwEweP-L8HE8A2dMAp4AaABAg,비원딜 중에서 괴물쥐의 위대한 역사를 새길 최고의 업적이자 최고의 걸작,2,nEjB426cU0k
UgyhQ5JI3bvz8Et3N7x4AaABAg,물쥐야 너가 영상이 삶의 원동력이다 많이 영상올려주러...,1,nEjB426cU0k
Ugy124eMH2Elk2CRda94AaABAg,12:58 진짜 ㅈㄴ뿜었네 말파 ㅅㅂㅋㅋㅋㅋ,50,nEjB426cU0k
Ugz0f5HV2XEtqJ8appR4AaABAg,텔타고 강제 무궁화호 개웃기넼ㅋㅋㅋ,8,nEjB426cU0k
Ugxzzn0TUnrAVYADWFF4AaABAg,물쥐 배필 ㅈㄴ 오랜만이다ㅋㅋㅋ 오랜만에 해도 죽지 않았네 쥐대장,22,B1HvnYFjLQk
Ugx5cWTZVo_kpPLVYFp4AaABAg,물쥐형 힘내자 요즘 모범택시에 악역으로도 나오던데 항상 응원해!❤,25,B1HvnYFjLQk
UgwWY65v8XxjB8lki9p4AaABAg,"솔직히 다른 게임도 자주해주면 좋겠다
사람이 좋아서 그냥 재밌음",47,B1HvnYFjLQk
UgwC0EFoDJmgKWLVquV4AaABAg,3년전에 물쥐 배필영상을 보고 입문했고 지금까지 23만킬 넘기고 수천시간 게임했는데 이제와서 다시보니까 기분이 묘하네요 ㅋㅋ 암튼 돌아와서 반갑습니다.,56,B1HvnYFjLQk
UgzUOSaXYofZINBJP7F4AaABAg,하 진짜 눈물 날거같네 3년전의 기억이 나네 ㅠㅠ,187,B1HvnYFjLQk
UgwOPbiP6tYMqBovy214AaABAg,아 진짜 개재밌다 고마워 공익분대장!!!!,19,B1HvnYFjLQk
Ugx4tyfGQw1UwYVK4DV4AaABAg,발로란트에 이어 다시 한 번 FPS 게임인 배필을 잡은 괴물쥐는 최고의 개추,12,B1HvnYFjLQk
Ugz8NidQuBWfTZfLRaB4AaABAg,진짜 오래만에 보는 배틀필드인데 이리 재밌게 하는 사람도 없다 ㅋㅋ,0,B1HvnYFjLQk
Ugyz9dSZXLl-oldhZSd4AaABAg,베히모스 떨어질때 무지성 거인 투하 ㅈㄴ웃기네 ㅋㅋㅋㅋㅋㅋ,5,B1HvnYFjLQk
UgxX3O3u8MHFXJjGoqN4AaABAg,오늘2시 군대가는데 저에게 딱 맞는 영상 감이네요 감사히 먹겠습니다 물쥐형님 늦아서 미안해요,2,B1HvnYFjLQk
Ugw-6xmuCnQg4EZ-4GR4AaABAg,진짜 물쥐형은 마스터 다이아 왔다갔다하는 횟수가 집나갔다가들어오는 횟수보다 많은것같어,170,sdX2EBSACDc
UgzY6IUWgouoC6Z_T_R4AaABAg,진짜 내가 다 눈물나오네.. 괴물쥐님 항상 응원합니다!!!! 화이이이이팅!!!!,0,sdX2EBSACDc
Ugx8xrcwP9L6hQ_Inpp4AaABAg,물쥐형 초심을 되찾았구나..! 쥐붕이+롤기견으로서 매일 롤 영상 올라와서 너무 좋다,18,sdX2EBSACDc
Ugyxh8GOVg6KIqPWcOl4AaABAg,ㅋㅋ 고물쥐님 다1빙 되는순간 입가에 저절로 미소가번지넹,32,sdX2EBSACDc
UgwnhI8TGaKg4kgtC9x4AaABAg,토요일을 마무리하는 괴물쥐 유튜브 폼 미쳤다 ㄷㄷ,20,sdX2EBSACDc
Ugy67WgRChtNNGatwGp4AaABAg,물쥐 요즘 왜케 웃기냐 ㅋㅋㅋ 한동안 안보다 ㅛ즘 다시보는데 텐션 올라왔녜 ㅋㅋㅋㅋ,73,sdX2EBSACDc
UgwKJ-yX3LS6Bv6xnPF4AaABAg,물쥐 그마가서 진짜 원딜 강의영상으로 컨텐츠 뽑는거 보고싶다. 언젠간 가겠지? 힘내라,42,sdX2EBSACDc
Ugxhk8EbF_F-lqwSaPJ4AaABAg,요즘 비원딜 하시는게 행복해보이셔서 너무 재밌습니다☺️,11,sdX2EBSACDc
Ugyh_UTnZpcJ73Vl_NZ4AaABAg,"와 진짜 어쩜 사람이 이리 한결같을까
마스터와 다이아 왔다갔다~~찍먹 이렇게 많이 하는 사람도 얘가 최초일듯
이정도면 다이아 씹고인물인데",3,sdX2EBSACDc
UgxJd_28QvmkXklE3RR4AaABAg,쥐도 항상고독하니 다2빙하길...,1,sdX2EBSACDc
UgyEJGpCr0n1KSo6zPt4AaABAg,물쥐님 즐기는거 처음보네요 ㄷㄷ 베이가 계속하셨으면 좋겠다,16,FpTvTwD24bc
UgxQB75hdVj-tTXrnQl4AaABAg,"확실히 물쥐님이 신나니까 영상이 더 재밌어졌어요.
욕도 많이 안나오고 보는 저도 신이 나네요. 화이팅입니당",80,FpTvTwD24bc
UgxlGYIdtzhEOPmzolt4AaABAg,괴물쥐 폼 진짜 무쳤다 ㅋㅋㅋㅋ 영상 올라오는 속도 레전드,143,FpTvTwD24bc
UgzzKk2L1YJZI0dNhgp4AaABAg,쥐환이형 왜 이리 귀엽냐ㅋㅋㅋㅋㅋㅋㅋㅋㅋㅋㅋ,5,FpTvTwD24bc
UgxeGiLEJ-MMmVaSA5V4AaABAg,근데 진짜 쥐환이 그마까지 승승장구 하는 것도 보고싶다 그 뒤는 다2빙 하던 내 알바 아니고ㅋㅋ,42,FpTvTwD24bc
UgxXihOp-sbkkjUPa2F4AaABAg,괴물쥐 베이가 망한판이든 이기는판이든 스택이 ㅈㄴ많이 쌓여있는거보면 진짜 베이가에 재능있는듯,1,FpTvTwD24bc
Ugy3FgkI-bPvRRAUa_d4AaABAg,우리 물쥐는 타이틀 갱신이 대체 몇개냐 끝을모르는폼....본받는다,1,FpTvTwD24bc
UgxBayxvQygfL8v2nfl4AaABAg,불금 물쥐형 영상은 못 참지 ㅋㅋㅋㅋㅋㅋㅋ,5,FpTvTwD24bc
UgwL574snaEguzWTvzt4AaABAg,13:18 진짜 터진게임 엘리스 어떻게든 안죽을라고 발악질무빙 개웃기넹ㅋㅋㅋㅋ,7,FpTvTwD24bc
UgzyZYuYv1yO-XtfnRt4AaABAg,그 서렌이 다2빙의 멋진 초석이 되기를 기원합니다.,17,FpTvTwD24bc
UgyXsEe0oUK5rgyAEbd4AaABAg,썸네일 미쳤다 진짜 ㅋㅋㅋㅋ 편집자 사랑해요 ❤,442,45N5gEiGbWg
UgzGAAEh3OcU4Tg5Nht4AaABAg,아 진짜 썸네일 편집자 보너스 좀 줘라 ㅋㅋㅋㅋㅋㅋㅋㅋㅋㅋㅋㅋ,1789,45N5gEiGbWg
UgwkuE7rVX44Ef7TxDJ4AaABAg,괴물쥐 썸네일 진짜 몇달전부터 준나웃기네ㅋㅋㅋㅋ 잘만든다,110,45N5gEiGbWg
UgyxS3fAhG_MgvlJBxJ4AaABAg,썸네일부터 마지막 엔딩까지 완벽 그자체,125,45N5gEiGbWg
Ugz8rD5jNdgD7HVWnId4AaABAg,5:03 상대 한번에 같이 넘어오는거 왤케 멋있냐,240,45N5gEiGbWg
UgxvL0Mo-199WzdhwWd4AaABAg,비원딜 선언을 뒤로하고 멋진 모습 보인 쥐리는 최고의 걸작,12,45N5gEiGbWg
UgyvbhZKphDc532Eqc54AaABAg,물쥐 형 이기고 기분 좋아하는거 보기 좋다 ㅋㅋ 즐거우면 된거지,5,45N5gEiGbWg
UgyrozwQtufzlLtQwl54AaABAg,물쥐형 먹방도 그리운데 한 번 올려주면 안될까,20,45N5gEiGbWg
UgzCqk7AAiiaA8AcNXF4AaABAg,물쥐형 100만 축하해!,0,45N5gEiGbWg
Ugw-pBa8W0JWsTFrHx94AaABAg,썸네일 너무 웃겨 ㅋㅋㅋㅋㅋ 잘 보고 있어요❤️,3,45N5gEiGbWg
UgwzYrLYxSuM7kOjQyF4AaABAg,행복하게 겜하는 모습 보니까 너무 좋다ㅎㅎ,342,WDSuLT2Jaao
UgwHmfrDFo_eVf51ERV4AaABAg,행복하게 방송하는거 보니까 매일매일이 기다려진다 스트레스 받지말고 즐겁게 게임하자,12,WDSuLT2Jaao
UgzC7Mp7SvQ8hdQeTrN4AaABAg,몇달동안 계속 화나고 고통받던 모습만 보다가 재밌게 게임하는거보니 보기좋다 ㅋㅋㅋ,288,WDSuLT2Jaao
UgxhmBSb2fXr5UrO-gd4AaABAg,근데 진짜 요즘 웃으면서 겜하니까 보기좋다ㅋㅋㅋ 더 재밌는듯 억까당하는것보다,70,WDSuLT2Jaao
Ugx_X4N-jYxxmYY1W6V4AaABAg,zzzz진짜 시즌시작하고 지환이형 재밌게 롤하는거보니까 나도 너무 재밌따 ! 이제 대세챔만하자,7,WDSuLT2Jaao
UgyR7ri-2n9tfSVMjWN4AaABAg,행복하게 겜하는 모습 처음보네 ㅋㅋㅋ,2,WDSuLT2Jaao
UgyGuarV0U8-37D8sl54AaABAg,썸네일 진짜 잘만든다... 항상 감탄합니다,9,WDSuLT2Jaao
UgyYqsSb9pioEXIGw4R4AaABAg,"억까받는 지환이의 모습 보고싶다
우리가 원하는건 이게아니야

지환이 억까당하는거 보는게 삶의 낙이었는데..",1,WDSuLT2Jaao
Ugx9oSfXkoAw27TwgbR4AaABAg,형을 보며 원딜 감수성이 미치던 시절이 있었는데 그랬던 형은 어디가고 그런 딸깍질이나 하고있어…😢,2,WDSuLT2Jaao
Ugzdg4kkQCXLWjqQ10V4AaABAg,원딜 버린다뭐다는 제쳐두고 물쥐형 기분좋게 겜하니까 요즘 보기좋네 ㅋㅋㅋㅋ,33,WDSuLT2Jaao
UgzzlJFS0BCPmmawWCx4AaABAg,이 사람은 원딜러의 배신자가 아니다. 그저 점수를 올리기를 간절히 원하는 처절한 원딜의 마지막 절규이다.,941,es3e0dRBcx0
UgyBa3wy7WyNsvfJL1d4AaABAg,어떻게든 그마가려고 아득바득 하시는 모습 멋있습니다 장쥐환 화이팅!!,18,es3e0dRBcx0
UgysxVW44EmYqMN-JF14AaABAg,"평타를 치지 않으며
ap템을 올리고
팀에 도움이 되는것을 하며 점수를 올리는 모습이 지환님께 잘 어울립니다",57,es3e0dRBcx0
UgxG_P1F2qKeHbvPArl4AaABAg,베이가 원딜해도 이렇게 재밌는데 ㅎㅎㅎ 롤 계속 해주세요!!!! 그마까지 화이팅!,47,es3e0dRBcx0
UgybZhLSnI7XUKGJs6Z4AaABAg,오늘도 원딜인권을 위해주셔서 감사합니다,6,es3e0dRBcx0
Ugx6N8aWaexL3WnKV494AaABAg,그립다... 괴물쥐의 피 땀 눈물 시절...,100,es3e0dRBcx0
Ugx8vdxeIIAT1W0OfQt4AaABAg,진짜 점점 나이가 들어갈수록 떨어져가는 피지컬과 점수에 치여 원딜 왕자의 긍지를 버리고 절규하는것 같아 마음이 무겁네,30,es3e0dRBcx0
Ugys2jRXAy1e-_R1aaV4AaABAg,지환아 제발 올해는 그마가자!!!! 원딜 왕자의 자존심을 포기해서라도!!,65,es3e0dRBcx0
UgwkSS5i9kWhDlO6Rml4AaABAg,금속노조에 이어 원딜노조까지....그는 어디까지 가는걸까,6,es3e0dRBcx0
UgzoN3yGZvpOjvdTjHF4AaABAg,너무 재밋따 그냥 웃겨 ㅋㅋㅋ 간절하게 질떄가 제일 재밌어 ㅋㅋ  빨리 올라가서 석현이랑 맞라인 대결 보고싶다 ㅎㅎ 곧 가겟찌 ?,5,es3e0dRBcx0
UgzZx4pNYjoP3iTolm54AaABAg,주말의 끝자락은 언제나 괴물쥐 다2빙이 최고의 마무리,89,Rjn7AIkBGCE
Ugy1ngB4Tas3igeTDy94AaABAg,썸넬 진짜 개맛있다 쥐집자님 하루종일 웃었어요ㅋㅋㅋㅋㅋ,8,Rjn7AIkBGCE
Ugx7YNwPlUyj6me1g1Z4AaABAg,캐리야 할때 버스야 하는거 ㅈㄴ웃기네 편집자 센스 지렸다 ㅋㅋ,139,Rjn7AIkBGCE
Ugysswd2cfeaInj7Iqt4AaABAg,이렇게 강인한 멘탈로 롤이 아닌 다른 일을 했다면 나라를 바꿨을 인재,50,Rjn7AIkBGCE
UgwYzsreG3JovkjqQgl4AaABAg,점점 낭만에서 멀어지고 현실과 타협하게 되는 나이가 되어가는 괴물쥐.....ㅠ,20,Rjn7AIkBGCE
Ugxv8HHE2bbYzvOLxvR4AaABAg,진짜 매 번 롤 영상 썸네일은 레전드구나 ㅋㅋ,6,Rjn7AIkBGCE
UgxOgDpFwIxtV8zalpN4AaABAg,베이가 사거리 버프 진짜 너무 좋음,1,Rjn7AIkBGCE
UgxvgN0va9diU4mcBMJ4AaABAg,세월이 야속하구나... 예전 같았으면 저런 비원딜이 설치고 다닐 때 황족원딜 보여준다며 뚜까패던 괴물쥐 어디감...,0,Rjn7AIkBGCE
Ugx_0qLN_hE8zk0IfEV4AaABAg,오늘플레로강등 역시 멀리서보면 희극인 괴물쥐,2,Rjn7AIkBGCE
UgwF4xwUhJhY4TjWe5F4AaABAg,주말 자기전에 최고의 야식 장쥐환 ㅋㅋㅋㅋㅋㅋㅋㅋㅋㅋㅋㅋㅋㅋㅋㅋㅋㅋㅋㅋㅋㅋㅋㅋㅋㅋㅋㅋ,1,Rjn7AIkBGCE
Ugy83q1_kosRd_kt-954AaABAg,"진짜 오늘 14판 돌리면서 느꼈던 것들이 물쥐님 말에 다 담겨있었네 진짜 열심히 잘하는 사람들만 병신되는 겜ㅠㅠ
이런걸 다 알고도 걸어가는 물쥐님의 뒷모습을 바라보며 많은것을 느낍니다 멋있습니다 물쥐님 흐에!!!!!!!!!!!",77,EE2eHFc_s5w
Ugx6klm2ZzC2ErLVYnR4AaABAg,안정적인 다2빙을 기원합니다,1,EE2eHFc_s5w
Ugx_9dRJ-N_yr3mMKMF4AaABAg,자신이 거부하는게 아닌 오히려 거부당한다는 것을 깨닫지 못하는 물쥐씨….,461,EE2eHFc_s5w
Ugze8tY3zz-KoWAl1JV4AaABAg,가라는 그마는 안가고 다2빙을 택한 괴물쥐에게 후회없는 목적이 되기를 기도합니다.,57,EE2eHFc_s5w
UgxB_vhDXXfgpyHgoWh4AaABAg,학교 개학 해서 너무 힘든데 이제 괴물쥐 영상없으면 못살겠다,51,EE2eHFc_s5w
Ugz8Lbj0MWkBOZli8hB4AaABAg,승격전 실패했는데 이영상보고 힐링중인 1인...,2,EE2eHFc_s5w
UgyKGJwZj_-6JOD6Iyh4AaABAg,마무리가 너무 완벽한데? 😂,4,EE2eHFc_s5w
UgwqCWUKenai_3IkMzZ4AaABAg,ㅋㅋㅋㅋㅋ진지하게 99점 얶까당하는 표정이 레전드네,3,EE2eHFc_s5w
Ugx9u7RtjT5KLlmjrK54AaABAg,바론에 헤카림궁 존나웃기네 ㅋㅋㅋㅋㅋㅋㅋㅋㅋ,7,EE2eHFc_s5w
Ugx24m1ZnCAf3kxr_bZ4AaABAg,일어나니까 영상떠서 행복한 백수면 개추ㅋㅋ,73,EE2eHFc_s5w
UgyqgNy7WFjr0lMSCCF4AaABAg,정보 : 지금현재 승급후 5연패뒤 1승진행중 마스터 찍자마자 빠른 다1빙실력을 보여주신 킹갓물쥐님 ㄷㄷ;,272,jNCuZpFbpcw
UgybeY0r4qJpctnE21F4AaABAg,방송의 재미를 위한 다2도 좋지만 그마 꼭 갔으면 좋겠어요 홧팅,167,jNCuZpFbpcw
UgyZBi4kcpNYNPjp2jZ4AaABAg,삼일절에 기모링 안쓰는 센스 좋았다,1653,jNCuZpFbpcw
UgyWS76gbIk3vxYukNR4AaABAg,승급후 기적처럼 5연패후 다이아 1 정착 ㅋㅋㅋㅋㅋㅋㅋ 형 그냥 다이아에 뼈를묻자….!,2,jNCuZpFbpcw
UgxI6IEFI0rkB1Wu1rV4AaABAg,진짜 소름돋게 바로 다이아로 돌아왔네 역시 장지환 난 널 믿었어,42,jNCuZpFbpcw
UgzdnnZ-XSWpUxu9mEZ4AaABAg,"지환아 우리가 진짜 마스터 가는거 응원했다  마스터 가는거 보니까 마음이 좋네 이제 다시 다이아 가자




다들 이날만 기다렸다",54,jNCuZpFbpcw
Ugz_SwEp2ZwY9PDyiYd4AaABAg,진짜 원딜은 보세인데 서폿플레이는 명품이다,39,jNCuZpFbpcw
UgwP1LVtoJFunlmkEb94AaABAg,물쥐형 올해는 꼭 그마가자!,34,jNCuZpFbpcw
UgwP3i38WTRXPWqHeqR4AaABAg,이번에는 꼭 그마 찍었으면좋겠어요 괴물쥐님ㅎㅎ! 높은 곳에서 떨어져야 더 아프거든요...화이팅!,4,jNCuZpFbpcw
UgzekfvBl-Smrr6FGyB4AaABAg,썸네일부터 이곳 주인장이 엄선해주는 다2빙은 최고의 금상첨화,5,jNCuZpFbpcw
UgzTv9JGmKAjtygBRQd4AaABAg,막판 앞라인 너무 든든하고,4,g5SbJNyjdzE
UgyCD-ZV7UK9ybus4l14AaABAg,탑의 은혜는 하늘 같지만 다2빙하는 괴물쥐는 심해 깊숙히 떨어져만 간다,99,g5SbJNyjdzE
UgzCkBdF6CKZGUulWdx4AaABAg,근데 진짜 편집자 편집 존나잘한다 생방다봤는데 텐션 ㅂㄹ였는데 이렇게보니까 또 ㄱㅊ네,81,g5SbJNyjdzE
UgwIM8sqDfJCopZQVnF4AaABAg,"이쯤되면 한번쯤은 그마갈만한데..
꼭 그마가고 다이아2로 시즌 마감해줬으면",13,g5SbJNyjdzE
Ugxiy1Ek6ZwfwarfFh54AaABAg,괴물쥐 라인전 하는거 보면 진짜 고통스러워 보임... 이정도 노력이면 마스터는 보내줘라,3,g5SbJNyjdzE
Ugz-GfblHORMgJo8qYx4AaABAg,14:46 장지환 띠리릭딱 폼 미쳤다,41,g5SbJNyjdzE
UgwqEtn9SX1PjRmF3Gl4AaABAg,요즘 괴물쥐 폼 장난 아니네 캬,2,g5SbJNyjdzE
UgywLj3bQQrMvF9yWvp4AaABAg,괴물쥐님 10연승하셨다가 20연패 하시길 기원하겠습니다. 아멘,2,g5SbJNyjdzE
UgxJWtdAFDzsh2np5aB4AaABAg,이번 영상 텐션 왜이리 좋아 ㅋㅋㅋㅋㅋ,13,g5SbJNyjdzE
UgxEZ2IMNUXv4CuNWtZ4AaABAg,"형 나는 보는걸로 이제 만족하려고 이게임 못하겠어.. 원딜이란 포디션 
물쥐형 존경해..",23,g5SbJNyjdzE
UgwruH7IULLCoqXyvZd4AaABAg,막판은 ㄹㅇ 억까받았는데도 적팀 실수한거 놓치지않고 그걸로 게임 끝내버리네 ㄷㄷ 역시 물쥐형,2,81Fs6W7tzGs
UgyI5O6LZ6bKaLvlUTV4AaABAg,ㄹㅇ 지환이 레드 뺏길때 반응이 너무 찰짐ㅋㅋㅋㅋㅋ,151,81Fs6W7tzGs
UgycQx2SQv90rphZMuR4AaABAg,썸네일부터 아찔하게 생긴 괴물쥐의 듀오 롤은 최고의 걸작. 그 기세로 더블 다2빙까지 꺾이지 않고 갑시다.,118,81Fs6W7tzGs
UgzkbghrqSh16EYWjaJ4AaABAg,근데 서폿분 진짜 잘하시네 한수배우고 싶을 정도임,1,81Fs6W7tzGs
Ugy2uqyh_5sDYrCCajx4AaABAg,지환이 오랜만에 흐름 놓지고 서폿의지하네ㅋㅋ,11,81Fs6W7tzGs
Ugw6hDtU9BIIij6tgTp4AaABAg,학원가는 시간도 이런 기분으로 기다려졌으면 좋겠다.,89,81Fs6W7tzGs
UgykFOT5g58Hv7_AwAV4AaABAg,7:40 편집자 자막 센스 ㅈㄴ 웃기네 ㅋㅋ,101,81Fs6W7tzGs
UgzQxDOyK3a86W9oQJd4AaABAg,자르반 걸어오는거 존나웃김ㅋㅋㅋㅋ,0,81Fs6W7tzGs
UgzCqv_QDwzLuqya-AJ4AaABAg,자칭 최고의 원딜러와 인정받은 서포터의 두오,9,81Fs6W7tzGs
Ugy1Resesp9PxuNZY3l4AaABAg,7:43 아 편집자님 센스 지리시네 개웃기네 말과 자막이 다른 ㅋㅋㅋㅋㅋㅋㅋㅋㅋㅋㅋ,52,81Fs6W7tzGs
UgzQKwxt5r9JZNihwI14AaABAg,확실히 연승하고 잘하니까 텐션도 오르고 보기좋다..,131,Z_EGrRM8xRc
UgwWwpjVS8P5rStWhPJ4AaABAg,서폿듀오분 진짜 잘하시네 듀오하는거 자주 올라왔으면 좋겠다,608,Z_EGrRM8xRc
UgxhwqP_yVruzyYPwh94AaABAg,형 이번시즌에는 꼭 그마 가자 화이팅 항상 응원해!!!,47,Z_EGrRM8xRc
UgzHw7JhfHdmVidJpKZ4AaABAg,제발 하루만 저 도구로 살게해줘…!,32,Z_EGrRM8xRc
UgwFT98_5OHImCQPWR54AaABAg,파이크님 아쉽지만 전역하고 더 좋은모습 보여주세요!!,4,Z_EGrRM8xRc
Ugy2VOk5-sQ3MRsqZt94AaABAg,오랜만에 잘하는 서폿이랑 듀오하니까 보기 좋네,10,Z_EGrRM8xRc
UgwO3KY3AbOSqD_OqI94AaABAg,레알 진짜 명품 도ㄱ..아니 서폿이네..개잘한다!,16,Z_EGrRM8xRc
UgxCmdISl_E95xyx7XB4AaABAg,1시간 늦었지만 괴물쥐의 다2빙은 꺾이지 않는다,9,Z_EGrRM8xRc
UgzYjpU6HApZJs3aPS14AaABAg,"서폿님 너무 잘하시네요.
자주 듀오 해줘요 물쥐랑 ㅋ",5,Z_EGrRM8xRc
UgxI_Al3ctnfnw1fIWJ4AaABAg,"이 영상은 파이크와 제리의 활약 듀오 영상입니다
피지컬 지리네",3,Z_EGrRM8xRc
Ugyw-VdGIEZezVM0knB4AaABAg,이즈판 생방으로 보고 이래서 생방 찾아가는거구나 싶었다... 진짜 꿀잼판이었음,57,r5XcUGZIlto
Ugxk95tKs8PKUYzuzHV4AaABAg,와 이판은 ㄹㅇ 진짜 잘했다,14,r5XcUGZIlto
Ugz4NTD9_y7wk0rhNht4AaABAg,물쥐님 이번시즌 그마 꼭가셨으면 좋겠습니다. 항상화이팅입니다,13,r5XcUGZIlto
Ugzu8QjhYYPCGuFf_wJ4AaABAg,"우리와의 ""약속"" 지켜줬구나 괴물쥐
퇴근하면서 극 절정 느끼고 있다",175,r5XcUGZIlto
Ugz4Hflqf7aelRPdkpB4AaABAg,이젠 그는 다이아의 진정한 수문장..,1,r5XcUGZIlto
UgwTxDv2y3E6NtPKThZ4AaABAg,물쥐형 이번판은 먼가 화가 많아보이는데 ㅜ 웃으면서 겜 하는게 보고싶다,5,r5XcUGZIlto
UgxVVEYFDeVj_zysS7t4AaABAg,좀보이드 할때의 행복한 모습이 그립당 ㅋㅋ..,4,r5XcUGZIlto
UgxJq5HpFSF9QIOx-XF4AaABAg,괴물쥐의 방송엔 항상 괴물쥐의 탄성이 흘러나온다,3,r5XcUGZIlto
Ugw4pQBE1fuAaDTKWXN4AaABAg,막판 쓰레쉬는 진짜 레전드네 ㅋㅋㅋㅋ,13,r5XcUGZIlto
Ugx8eFIG4r1__d2Zoix4AaABAg,시험보기 직전에 괴물쥐는 못참지,0,r5XcUGZIlto
Ugw_6o2FyVhafu_ecOd4AaABAg,야 이거 웬만한 가이드 영상보다 설명이 자세하네 편집자 개열일했다,395,uVs3IcpGbP0
UgzTOT9ND7g9Zxwd0z94AaABAg,"쥐집자 편집 개 잘했다
우리가 공부할때도 틀린거 오답노트 하듯이, 설명으로 어떻게 파훼하는지 알려주면서 플레이 보여주면서 물쥐가 죽을 때 왜 죽었는지도 설먕해서 오답노트가 되었음
정답만 달달달 외우는 것보다 어떻게하면 틀리는지 알고, 안틀리게 하는게 최고라 생각함
쥐집자 잘했다!",32,uVs3IcpGbP0
