comment_id,comment,likeCount,video_id
Ugz3GYQSZrUod2rqVRV4AaABAg,밀탱크 질 때 표정 개맛있네ㅋㅋㅋㅋㅋㅋ,4,sR6QFMNt4rY
Ugw54LrO6Ox1UrroLj14AaABAg,근데 당해본입장으로는 부트라게뇨가 오면 진짜 빠르고 수비하기힘듬,3,sR6QFMNt4rY
UgxxiUinni8QC2V0wmx4AaABAg,"진짜 상호형 10년 전부터 봤지만 요새가 형 전성기인 것 같다
글고 할아버지랑 통화할 때 최근에 웃은 것 중 가장 많이 웃었다
재밌는 영상 많이 남겨줘서 고마워 형 ㅋㅋㅋㅋㅋ",8,dJvZQKYP5cM
UgyzlSwDEAR1JeFRhrl4AaABAg,"이상호님은 방송에서 오래봐왔는데 정말 착하신것같아요
항상 건강하시고 하는일 잘되길 빌어요ㅎ",10,dJvZQKYP5cM
Ugy79BiUhpLFhyY-i8x4AaABAg,상호 할아버지 오래오래 건강하세요,819,dJvZQKYP5cM
UgwD5p7EwOFRULURJI94AaABAg,"조지 베스트는 뮌헨 대참사이후 맨유가 발굴해낸 최고의 재능이라 평가받음
데니스 로 조지 베스트 바비찰튼 당대 최고의 트리오로 에우제비우 이끌던 벤피카를 상대로 챔스우승까지 해내고
그걸 기념하기위해 올드트래포드에
트리오 동상이 세워질 정도였음",42,dJvZQKYP5cM
UgwuzeZngb2Ff25bsEB4AaABAg,와 맨유 올스타 올미페 짜보려고 조지 써볼까 고민중이였는데 고민이 아예 싹 사라졌어요!! 고마워요 상호님!!,6,dJvZQKYP5cM
UgylpyUBbOULou9FOW14AaABAg,"속도도 미쳤고 슛파워도 미쳤고....
조단위 선수 미쳤따

근데 중거리 개억까 돈슛이 그냥 폭포마냥 계속 터지진 안하네 키컨 때문인가",4,dJvZQKYP5cM
Ugyz0UB_y96vrfbzbdd4AaABAg,이상호 조지 폼 미쳤다..,252,dJvZQKYP5cM
UgzG0q6ejvhz9uFPF4x4AaABAg,아 이상호 조지베스트 언제 올라오나 진짜 ㅈㄴ 기다렸네 드뎌 올라오네 숨 좀 트인다,39,dJvZQKYP5cM
Ugy1jyYbLDrKe96jxY94AaABAg,클래식 맨유 폼 미쳤다 ㄷㄷ,3,dJvZQKYP5cM
Ugy3Ui8vOICsrh3psbB4AaABAg,이상호 조진 폼 미쳤다;;,19,dJvZQKYP5cM
Ugws76FDGax_E_NH08B4AaABAg,진짜 스트님 오랫동안 방송봤는데 요즘 행복해보이셔서 다행이네요 진행도 너무 깔끔하고 세분 다 방송 잘하시는게 느껴져서 흐뭇하게 봤네요 ㅎㅎ 항상 응원하겠습니다!!😊😊,22,GdUV5FEV8Dc
UgzuB5whEvehXGZyyMV4AaABAg,스트형 텐션 미쳤다 ㅋㅋㅋㅋㅋㅋㅋ텐션으로 상호를 묻어버리네 ㅋㅋㅋ,6,GdUV5FEV8Dc
Ugy9kRXIWPSV2Oina3d4AaABAg,감스트랑 이상호가 왜 진작 안만났을까 세월이 아쉬움 ㅋㅋ둘다 착하고 선하고 바보형 이미지에 그냥 너무 잘 맞음 ㅋㅋㅋ감상뿌 너무 좋아 뿌꾸형까지 사람이 너무 좋고 시너지미침,15,GdUV5FEV8Dc
UgyhETwmRWHScDvYHE94AaABAg,"어제 감상뿌 합방 존나 웃겼는데 ㅋㅋㅋㅋㅋㅋㅋㅋ
토크하는것도 재밌고, 춤추는 것도 존나 웃겼음",90,GdUV5FEV8Dc
Ugw9GctGR_h-D_esZjF4AaABAg,와 진짜 다 대단한 비제이들인데 감스트가 미치긴 했네 ㅋㅋㅋㅋㅋㅋ 괜히 공중파도 나오던게 아니여,17,GdUV5FEV8Dc
UgzuPzRCqLsjbvIeGqZ4AaABAg,진짜 셋다 결이 비슷해서 너무 좋음 ㅋㅋ 감상뿌 정기적으로 꾸준히 해줬으면...,33,GdUV5FEV8Dc
Ugw7r94nQNdUy_9YEQV4AaABAg,진짜 생방 레전드였다. ㅈㄴ 웃겼음 ㅋㅋㅋ,5,GdUV5FEV8Dc
UgzI9_X22PP-S_4HQk94AaABAg,합방레전드는 진짜 쀼꾸형 관제탑이 베스트였음 ㅋㅋㅋㅋㅋㅋ표정이 걍 십사기,101,GdUV5FEV8Dc
UgwKRc2tzSht090736h4AaABAg,어제 합방 ㅈㄴ 재밌었음 ㅋㅋㅋ 또 뭉치자,22,GdUV5FEV8Dc
Ugy2z1Ji70Xv2lIIx4t4AaABAg,감스트 텐션 ㄹㅇ 기빨린다아..,19,GdUV5FEV8Dc
Ugww-H_HT413GtGXJKt4AaABAg,와 진짜 선수에 대한 애정도 있고 감각도 좋다는것이 느껴지네.,461,xjS4or2gITc
Ugw-X3aHVnEDlxsBAwR4AaABAg,진짜 팀에 애정이 있다는 게 느껴진다.,188,xjS4or2gITc
Ugy2SkIQ2s5PHWSobiV4AaABAg,컨텐트 너무 좋다 ㅎ 이상호처럼 한팀가지고 오래 꾸리는걸 보는재미도 진짜 좋은듯,105,xjS4or2gITc
UgzMJtVzZmHp61IO4mt4AaABAg,확실히 상호가 중거리 위주로 플레이 하다보니 중거리 때려보고 바로 아네 반페르시는 약발로 차봐야 한다는 디테일도 놀랍고 중거리 워낙 많이 때려봐서 걍 이 선수로 이 위치에서 중거리 찼을때 슛 궤적이나 느낌을 다 파악하고 있는듯,134,xjS4or2gITc
UgwQHGTacqJRK6DrtzJ4AaABAg,와.. 상호형 진짜 미쳤다.. 돈 지른거만큼 진짜 팀을 사랑하네.. ㄷㄷ,41,xjS4or2gITc
Ugx3kIIFy4ABZYDNCpN4AaABAg,이거 너무 재밌는데 자주 해주세요ㅋㅋ 잘맞추면 3카로 올려보고 이런식으로 난이도 조정도 올려서 진짜 체감의 신인지 테스트해보는것도 재밌을것같습니다,4,xjS4or2gITc
UgzBylV8WKYOz_pxrYB4AaABAg,이렇게 신선한 컨텐츠 너무 좋다 ㅎㅎ 재밌게 잘 봤습니다!!,8,xjS4or2gITc
UgwQO_BVppEiTsJULeZ4AaABAg,봉훈이는 팀에 은카많아서 금카보단 달라진거 잘 못느낄텐데 진짜 대단,120,xjS4or2gITc
Ugyh4-67RL5ONZVK2eJ4AaABAg,팀에 애정이 있어야 저런걸 맞춘다 이상호는 진짜다,28,xjS4or2gITc
UgwI2XUnz5bF4fpQwYR4AaABAg,슛까지 차보면 할만하지 근데 체감만 보고 맞추는건 ㄹㅇ 대단하네,34,xjS4or2gITc
UgxTsp76XX6_Vx47k094AaABAg,돌아와도 지성이형 끝까지 안 사는 상호 폼 미쳤다,246,0_j6zlmXcWI
UgyZr5TmnywmuBLJb8F4AaABAg,"아~ 대회 광탈해서 다행이다 
이상호가 맨유 쓰는거 다시 보고싶었다
유튜버들 상호 피파하고 있으면 한번씩 찾아와서
디코키고 한번씩 경기했음 좋겠다",40,0_j6zlmXcWI
UgymIlFheddgGQfL3f94AaABAg,자기와 잘 맞는 팀을 찾아서 잘 사용할줄 아는것도 능력이긴함 실력은 월클 1부지만,7,0_j6zlmXcWI
Ugx5jDTKYSpfQ5tCBMx4AaABAg,땅호띠는 입 털다가 골먹히면 조용해질때 제일 재미있다!!,6,0_j6zlmXcWI
UgwjbFvMWBiz51zwPl14AaABAg,드디어 팀빨을 인정하는 땅호리,523,0_j6zlmXcWI
UgxVaVb3gaOwgxSZBht4AaABAg,형 팀빨인거 인정하는 모습 보기 좋아,105,0_j6zlmXcWI
UgyGU7AEdWY9xlpt4pt4AaABAg,이상호 본심 폼 미쳤다,21,0_j6zlmXcWI
UgxCc1Hgjd5I2_lsrJJ4AaABAg,아니ㅋㅋㅋㅋ다른데서 뚜드러맞고 뀨알한테 화풀이 ㅅㅌㅊㅋㅋㅋㅋㅋㅋㅋㅋㅋ,161,0_j6zlmXcWI
UgxaYdzHMZy-_kA8vfJ4AaABAg,만만할거란 조를 바꿨지만 올라가지 못한 상호의 발악st 보여주는 영상,7,0_j6zlmXcWI
UgysOzZQFRgDja_S9Ut4AaABAg,토너스트레스나 대기할껏두 없이 바로바로 🐷홀📨카🎒홀🌐카🏢n🎡e⛺️t🌇 넘죠아,0,0_j6zlmXcWI
UgxEWUUG0i6d8ROQdTZ4AaABAg,내가 다 긴장되는 경기 였다 .. 상호형 고생 많았고 다음 경기때 제대로 보여줘요 😊😊,9,7ht6CndYGpM
Ugwa2eeh8cRqnSeBOjJ4AaABAg,와.. 진짜 명경기네,4,7ht6CndYGpM
UgzkIucGARj4JAHw7dx4AaABAg,솔직히 못하지도 않았고 나폴리 치고 진짜 열심히 잘했는데 이번판은 양한빈이 진짜 ㅈㄴ잘했다,149,7ht6CndYGpM
UgxV-htvGSLh0-IJK7t4AaABAg,8강 진출 축허드려용~~~~!🎉🎉🎉🎉🎉🎉,10,7ht6CndYGpM
UgyMS1sWo3BKfnPR6z54AaABAg,ㅈㄴ 재밌었다 ㅋㅋㅋ 긴장감 개쩔었음,16,7ht6CndYGpM
Ugz4oJtNdJMyC7Z4MDx4AaABAg,상호씌 뿌챔스 보면서  진심으로 임하는거 잘 봤어 너무 이쁘더라. 아쉽게 졌지만 최선을  다하는 모습 너무 보기 좋아. 시청자는 노력하는거 다 알아! 앞으로도 오래 보고싶다,5,7ht6CndYGpM
Ugw_OVjOXTyzxJpcj_14AaABAg,너무 긴장했어 땅호형 ㅜㅜ 아쉽지만 명경기였어~ 고생했어,88,7ht6CndYGpM
UgxZVCY4CRHPGPwRBq14AaABAg,"다음 대회에 보여주자!
잘했어요 형.",35,7ht6CndYGpM
Ugzq41zYX1KrQ7G-i1t4AaABAg,다시 행복하게 베컴으로 ZD 쏘는 상호씨의 모습~~,5,7ht6CndYGpM
UgynBwpk3PHFPTDD6at4AaABAg,"어제 아방으로 9시부터 상호경기까지 생방보고, 교튜브로 보고 상튜브까지 보러왔다!!! ❤ 떨어졌지만 고생했어,, (김민교 응원함ㅋ)",4,7ht6CndYGpM
UgyI0QDcF9nd5gdR2JZ4AaABAg,김민교랑 붙을땐 찐웃음 나오는 리상호ㅋㅋ 설마 둘이 16강에서 만날줄이야ㅋㅋ,35,WMVY43OWGyY
Ugz4SNz9fgnJnp3WmgN4AaABAg,상호 민교 16강에서 바로 만날줄이야ㅋㅋㅋ 기대된다,133,WMVY43OWGyY
UgzR41qHBkWRNvkHyfR4AaABAg,"5:42 클리셰를 꽂아버린 순간 
예약되어버린 16강",29,WMVY43OWGyY
UgxsMfy909UhG9sZ9PV4AaABAg,이상호 그는 피파의신인가,2,WMVY43OWGyY
UgyN0WGBIwdATXCsapR4AaABAg,아니 민교님하고 상호님 두분이서 미래예지를 시전해버리시네~,6,WMVY43OWGyY
Ugw7HJEOPWoVolYI9894AaABAg,"범신 쿠신 반데사르 이런애들은 국대도하고 클라스있어서 피파도 좋게나오는건 인정하는데..

첨듣는분이 왤케좋아...키퍼는 키가크면 너무좋게 설계되어있다 피파는 하",2,WMVY43OWGyY
Ugxxas1JcfnFQxOkbfp4AaABAg,민교는 말투 자체가 개웃기네ㅋㅋㅋ,1,WMVY43OWGyY
UgyBqli5COjIo-ciHGR4AaABAg,상과 교의 16강전 기대해봅니다.,51,WMVY43OWGyY
Ugw4DvovmD14Ylhvuzp4AaABAg,카바니 성기슛 미쳤다,4,WMVY43OWGyY
Ugysjhep7p5z9OCy93F4AaABAg,이상호 탈락 ㅈㄴ 아쉬우면 개추 ㅋㅋㅋㅋ,12,WMVY43OWGyY
UgyKg3c80SwSXw2ow7N4AaABAg,저게 뜬거 아니라 강화로 붙인거라는게 놀랍다 진짜 미페까지 완벽해서 가지고 싶다...,343,ptTdzQEtxfs
UgzNEsFcBn1pdv5YqqN4AaABAg,포그바+호동생보면 패션맨유가 맞기 때문에 이상호에겐 미페는 일도 상관없다,18,ptTdzQEtxfs
Ugz_dLmGPma1GJJxj1N4AaABAg,레엠베컴 3카만 예전에 써봤었는데.. 진짜 미페 + 페이스온 + 성능 뭐 하나 빠지는게 없음... 뽕 ㅈㄴ 참 ㄹㅇ,80,ptTdzQEtxfs
UgxRiUiEmTWGpWEJB8t4AaABAg,우와 레알 하시는  분들  진짜  갖고  싶겠다  커브  145...   미페  이쁜거  봐라,24,ptTdzQEtxfs
UgwuDgt7b8lSHfBJ4BJ4AaABAg,대회기점으로 유튜브 확 노저으는거 보니 볼거 많아서 좋다,32,ptTdzQEtxfs
UgyIEMsaGcDuvg4jhOt4AaABAg,베컴 폼 미쳤다,33,ptTdzQEtxfs
UgyMAGMy-wxOgQeyjOl4AaABAg,이상호 베컴 가스라이팅 폼 미쳤다,6,ptTdzQEtxfs
Ugz0Hp7S_qwEyf6-UwN4AaABAg,이거는 재료비만 한팀 구단가치 넘을텐데 ㄷㄷㄷ 갱장하네😮,3,ptTdzQEtxfs
UgySTqMgm87IyUaPoPJ4AaABAg,프로게이폼 미쳤다,15,ptTdzQEtxfs
Ugy4DS296HDetneqkT94AaABAg,솔직하게 ln베컴이랑 큰차이 없어 보이긴하는데 이형이 금발장발 베컴 금카 영입해서 공경하는 거 보고싶긴함 ㅋㅋㅋ,18,ptTdzQEtxfs
UgyVlf2tX2SePfspLj14AaABAg,방송감 폼 미쳤다,38,tqlxuYOiX9Q
Ugw6V0CuTOmcMM5nwzh4AaABAg,피파할 때마다 보는거지만 스루패스로 한참 뒤쳐진 상대방 공격수가 빠르게 달려와서 우리팀 수비 제끼면 좀 어이없긴 해요,35,tqlxuYOiX9Q
Ugz6q2AkxVw5xS7UNvl4AaABAg,나폴리를 저렇게 잘쓴 상호도 대단하긴하지만 zd말고 그냥 뚫고 d때렸으면 무승부 가능 했을거 같은데 아쉽네,19,tqlxuYOiX9Q
Ugw3_ZgsiE5D4BcG5VV4AaABAg,이정후 폼 미쳤다,117,tqlxuYOiX9Q
UgzXFYEO8Botm1M8BYd4AaABAg,나폴리로 이정도하는게 개지리긴해…ㅋㅌㅋㅋㅋㅋㅋㅋㅋㅋㅋㅋㅋㅋㅋㅋㅋㅋ,168,tqlxuYOiX9Q
UgyDln9xuDrf_-3LeWx4AaABAg,이상호 비록졌지만 개잘해진거 티가 난다!,10,tqlxuYOiX9Q
UgyHA-QqZZqVylZa5Gp4AaABAg,이상호의 zd는 예술이다 -DNB-,34,tqlxuYOiX9Q
Ugzg6HAuui_j7qVmbLN4AaABAg,땅호리의 나폴리에는 감동이있다,11,tqlxuYOiX9Q
UgwmPapnu8r4e7cx7qp4AaABAg,아니 나도 무의식적으로 상호=봉훈이라고 생각하고 있었네 ㅋㅋㅋㅋ,30,tqlxuYOiX9Q
UgwFNpoJCcAWWHSkBNp4AaABAg,우선  16강은  진출해서  다행  ㅎㅎ,13,tqlxuYOiX9Q
UgwR-4eBbIFiZsGdCIZ4AaABAg,이상호의 플레이가 무엇인지 베컴 빨이 아니라는 것을 왜 뿌드컵을 우승했는지 증명해주는 게임이였다...... 가슴이 웅장해진다,86,LkHepXvHrpU
UgyOnf8xEcZ0plfhhxt4AaABAg,항상 중요한 경기에는 초집중해서 잘하는거 보면 뭘해도 성공할 사람인듯,64,LkHepXvHrpU
UgxG2XnkL0nEEn39U-F4AaABAg,이상호의 zd는 뭔가 낭만이 있다. 그저 폼이 아주 미친게 학계의전설 ㄷㄷ,194,LkHepXvHrpU
UgzIIsKt9_QOOShvQsx4AaABAg,ZD 지린다 이상호의 ZD 는 감동이 있다.,85,LkHepXvHrpU
UgwXXTw-EYlZqup72dZ4AaABAg,유저들이 이상호는 ZD밖에 못찬다 라는 편견을 제대로 박살내고 오직 실력으로 승부한 경기였다 ㄷㄷ...,7,LkHepXvHrpU
Ugx-PWaAUR_Weyxj_KR4AaABAg,진짜 감동이 있다 이상호 피파는,33,LkHepXvHrpU
UgzDbNdZZi0Lp5Bjws14AaABAg,와 근데 별 차이 없는거 같으면서도 bgm이나 이런거 깔리면서 코믹하게 편집 잘 하니까 원본영상보다 훨~~~~~~씬 재밌고 맛깔나네;; 편집의 힘이구나 이게.. 원래 이상호경기 다 재밌긴하지만은,25,LkHepXvHrpU
Ugxme0f_ZfbLcNibcHB4AaABAg,나 진짜로 상호형 돈슛이라고 생각했던 악성인데 이제는 인정할게 ㅈㄴ 멋있다,14,LkHepXvHrpU
UgxI8ZWwuz3uNBH5vWN4AaABAg,진짜 피파4 역사의 획을 긋는 zd 스페셜리스트네ㅋㅋㅋㅋㅋㅋ 2경기 동안 zd로만 4골ㅋㅋㅋㅋ,175,LkHepXvHrpU
UgxOqNrGbynRJSOVAT54AaABAg,하나의 분야를 압도적으로 잘하는 사람을 장인이라고 한다면 띵호리는 zd장인...,4,LkHepXvHrpU
Ugx5BBjoo5Xlt5suTwF4AaABAg,선수 새로 알게될때마다 불양TV 시청해서 내적친밀감 쌓는거 개웃기네 ㅋㅋㅋㅋㅋㅋㅋㅋㅋㅋㅋㅋ,449,wfttdA-BMm0
UgyU3d26dGejE_tcs-x4AaABAg,5:35 ㅋㅋㅋㅋㅋㅋㅋㅋㅋㅋㅋㅋㅋㅋㅋㅋㅋㅋㅋㅋㅋㅋㅋㅋ 둘 다 개 착해지는거 너무 웃기네 ㅋㅋㅋㅋㅋ큐ㅠㅠ,65,wfttdA-BMm0
UgzhvVCZtQtQ3jJCxEl4AaABAg,진심게임 지렸다ㅋㅋㅋㅋㅋㅋㅋㅋ 놀이터에 아주머니들 같았다ㅋㅋㅋㅋㅋㅋㅋㅋㅋㅋㅋ,27,wfttdA-BMm0
UgwzGoQQBqn1xbn_4jF4AaABAg,팀빨인건 맞지만 그래도 방송유쾌하게 이어가서 재밌음ㄱㅋㅋㅋ,3,wfttdA-BMm0
UgxHDydY6MP20QRbqJd4AaABAg,진짜 이상호는 불양TV한테 고마워하고 합방한번했으면 좋겠다ㅋㅋㅋ,33,wfttdA-BMm0
UgwivdqHwarAeEByo0d4AaABAg,이번편 개웃기넼ㅋㅋㅋㅋㅋㅋ,15,wfttdA-BMm0
UgwgLYKtHurv8ptaYEN4AaABAg,하루에 영상 2개씩 올라오는거 넘모 좋고,100,wfttdA-BMm0
UgyaC_8oUDluy7J4EN14AaABAg,이상호 폼 미쳤다,10,wfttdA-BMm0
UgxCmnHjRYkuXno92hl4AaABAg,호🥊구님들 덕에 매일 이🥊득보고 환🥊전해감 고맙다~ 🎽인🎽포🎽커🎽,1,wfttdA-BMm0
Ugy5KfOU-t_ydRSX7u14AaABAg,상호님 하루에 영상2개는 저에게 크나 큰 오예입니다.,6,wfttdA-BMm0
Ugzzebb8HLnildlEBzl4AaABAg,박수치면서 웃다가 급 무표정 정색하는거 ㅈㄴ 웃기넼ㅋㅋㅋㅋㅋㅋㅋㅋㅋㅋㅋㅋㅋㅋㅋㅋㅋㅋㅋㅋㅋㅋㅋㅋㅋㅋ,329,5aZjJRULs4o
UgzmYFJTYCtCpBgp3Zd4AaABAg,진짜 유벤투스 팀 개지린다 소름 돋네 ㄷㄷㄷ,106,5aZjJRULs4o
Ugyb48TxhVm-LFWHVDJ4AaABAg,스맵 이상호 서로 깐브우~ 이러는거 ㅈㄴ귀여움ㅋㅋ,8,5aZjJRULs4o
UgwGAgCJ53WrcQ7lH714AaABAg,봉훈이랑 하는것도 재밌긴한데 오랜만에 깐부 보니까 재밌네 ㅋㅋㅋ,108,5aZjJRULs4o
UgyIiRhu8OoehwPXM154AaABAg,상호형은 질때가 가장 재밌어ㅋㅋㅋㅋㅋ,27,5aZjJRULs4o
UgyiVGaBSfJelagyfAd4AaABAg,상호는 피파에 진심이다,38,5aZjJRULs4o
UgzZSzesfVl1yCowrdN4AaABAg,11:30 애교용 목소리 겁나 귀엽네 ㅋㅋㅋㅋㅋㅋㅋㅋㅋㅋㅋ,32,5aZjJRULs4o
UgzVwHFfz_fVBkdvTeR4AaABAg,발목돌리기 존나웃기네 ㅋㅋㅋㅋㅋㅋ,2,5aZjJRULs4o
UgxI11n19P8L63bVhhV4AaABAg,구단가치 제한 없으니까 팀차이 개쩌네 ㄷ,23,5aZjJRULs4o
Ugx05WLBce7VVrYWnIJ4AaABAg,아니 자꾸 웃다가 정색하는게 ㅈㄴ 웃기넼ㅋㅋㅋ,4,5aZjJRULs4o
UgyjRTNjfBiQ7wQbH4t4AaABAg,이상호 우승하면 함시크머리 가겠습니다,1454,Z70mgRpp2rQ
UgwAKR0cuhi_amL79px4AaABAg,"2일의 법칙을 깨고 영상 더올려버리네..
사랑한다 이상호..",59,Z70mgRpp2rQ
UgwqupfuuysQkbuT8J14AaABAg,5:02 진짜 봉훈이 드립 개미쳣네 개강해서 ot하는데 터짐ㅋㅋㅋㅋㅋ,32,Z70mgRpp2rQ
Ugx2bMDk9UcAuKDzxtR4AaABAg,더 zd가 아닌 더 함시크 폼 미쳤다 ㄷ,63,Z70mgRpp2rQ
UgzJiZvVvwd3Z5LyZ554AaABAg,2번째 골은 ㄹㅇ미쳤네,5,Z70mgRpp2rQ
UgwNkl1ccz34CavEjgh4AaABAg,상호 게임할때 입다무니까 존나 간지난다 ㅋㅋㅋㅋㅋㅋㅋㅋㅋ,7,Z70mgRpp2rQ
UgwlpcGyQEq8mUnA-GR4AaABAg,이상호 집중 하니까 진짜 잘한다.뿌챔스 우승 가자!,4,Z70mgRpp2rQ
Ugw-Lgpn2X2KwVikh1F4AaABAg,이상호 ㄹㅇ 피파 실력 인정,7,Z70mgRpp2rQ
Ugwf97iLpdljZb_EIfF4AaABAg,확실히 이상호가 나폴리 걸린건 행운 같다. 팀빨도 아니고 비슷한 환경에서 다양한 패턴을 알게 되든 듯. 순위와 상관 없이 좋을 듯.,7,Z70mgRpp2rQ
UgzchWflpK9I_6FrlRJ4AaABAg,9:29 시원한해설 ㅋㅋㅋㅋㅋㅋ,11,Z70mgRpp2rQ
UgzcCQPBvMyZeWvzV9p4AaABAg,진짜 잘한다 이상호..,12,6NmShHSSLGQ
UgxRncXoE_MXjU-uBqF4AaABAg,나상호 폼 미쳤다;;ㄷㄷ,57,6NmShHSSLGQ
UgwIqdQUymktY0N3gCd4AaABAg,진짜 주멘 넘어졌는데 바로 일어나서 골넣는 코다리ㅋㅋㅋㅋ + 48초부터입니다,172,6NmShHSSLGQ
UgwdQ0DA2S-Wgktx9-B4AaABAg,이폼 미쳤다,3,6NmShHSSLGQ
UgxREuh6isR2pWvDmdB4AaABAg,이정도로 거울치료받는건 처음보네 ㅋㅋㅋㅋㅋ,43,6NmShHSSLGQ
UgyRCo7-DLvdn3mQ0RZ4AaABAg,상호 나름잘하는데 나폴리로 우승은 좀 많이 빡셀듯ㅋㅋ 저번 우승했을땐 영국이라 팀도 좋고 베컴도 있고 괜찮았는데,20,6NmShHSSLGQ
UgzTZjmonwWcXFLegVV4AaABAg,"나폴리만 2년째 하고있는 유전데요
다른선수는 몰라도 함시크랑 디로렌초는
정말필수입니다..대체불가에요",4,6NmShHSSLGQ
UgyQL0IpJgpYZR5s1oJ4AaABAg,얘 거울치료 당하는 거 보니 속이 다 시원하네 ㅋㅋ,2,6NmShHSSLGQ
UgzCB6dia_mUhgqeADp4AaABAg,형 나폴리는 중거리 안되까 다른 루트를 찾나봐야 할거 같아,10,6NmShHSSLGQ
UgzsV3Rlj8_Uq-xbiVN4AaABAg,와 졸라 퍼터 치고 달리는데 차두리 존나 뛰어오니깐 존나 무섭네 ㅋㅋㅋㅋ,26,6NmShHSSLGQ
UgzfDo3Fss6-jlgxJTN4AaABAg,피파 비제이들 모여있으니까 너무 좋다,86,frCNtyavWb8
UgwEbJpyPQ7pxFlrJ9l4AaABAg,진짜 생방 보다가 스트형 보고 개웃엇다 ㅋㅋㅋㅋ 방송 ㅈㄴ 잘살림,242,frCNtyavWb8
UgylZ_b-yvzVR2RZWlJ4AaABAg,정무형과 감스트의 포옹 웅장하다 9:18,57,frCNtyavWb8
UgwK3z23HNvnqVBWJHZ4AaABAg,상호님 피파유튜브만봣는데  공방 꾸미신거보니 색다른이미지네 ㄷㄷ,23,frCNtyavWb8
UgwydKZc5Bc-yKAq96l4AaABAg,진짜 존나 재밌겠다 ㅋㅋㅋ상호 우승 가자 ㅋㅋㅋㅋ,31,frCNtyavWb8
Ugyf6bEu46Ymhq_zfux4AaABAg,나폴리라 이번에 좀 힘들것같긴한데 그래도 연습 열심히 해서 보여줬으면 좋겠다 땅호리 화이팅 !!,33,frCNtyavWb8
UgxnAQal4j2jltLwL8N4AaABAg,"몇년만에 퀄리티 좋은 대회다
좋은지원에 축제구나
꾸티뉴 울산현댘ㅋㄱㅋㅋㅋㅋㅋ에 조까지 바꿔버리누ㅋㅋㅋㅋㅋ",14,frCNtyavWb8
UgxhvkJ1VgI0fpN0Hf54AaABAg,이주헌 폼 미쳤다,6,frCNtyavWb8
UgzsJ10Eds2meexb9ZF4AaABAg,"이상호,뿌꾸형 두분 MC폼 미쳤따",25,frCNtyavWb8
Ugy0GgPbKzcsJUA3mEp4AaABAg,임유진 폼 미쳤다…,13,frCNtyavWb8
UgygAiSztHufnkqY3yV4AaABAg,"풀백으로 린가드를 쓰는 상상력 ㄷㄷ
진짜 미쳤다 이상호 미친놈;;",151,X5TL8aO32Iw
Ugy68Gfz7gUTZdL6zeV4AaABAg,린가드 왼쪽 윙백쓰면 생각보다 침투 잘하고 zd 기회 많이 열려서 전 꽤 좋게 쓰고있어요ㅎㅎ,3,X5TL8aO32Iw
UgzKiO9pzEQfDlHlXyd4AaABAg,ㅎㅎㅎ 계속 봐왔지만 두분의 케미가 정말 좋은가같아요! 너무 재밌었습니다,12,X5TL8aO32Iw
UgyKkqf2628gI1nF2bJ4AaABAg,상호형 진짜 폼 미쳤다,36,X5TL8aO32Iw
Ugwps37AJH7iANDiHVd4AaABAg,린가드 폼 미쳤다..,42,X5TL8aO32Iw
Ugy50hewcoJUMrp5OMt4AaABAg,상호씨 그냥 미쳤다,12,X5TL8aO32Iw
Ugx9Dv-8dKNQUYb2lHZ4AaABAg,4:14 우승후보->웃음후보 봉훈 펀치라인 지렸다 ㄷㄷ,33,X5TL8aO32Iw
Ugyz7ZaqVOVmnkXPCwN4AaABAg,수비력 강화용으로 훈코 역압박 넣고 쓰면 좋을등,6,X5TL8aO32Iw
UgziKyRDlhq0hyvTGvN4AaABAg,RW 사고 지성이형 잊은 무지성 폼 미쳤다 ㄷㄷ,7,X5TL8aO32Iw
UgxsxQjQkLgkCzUv2Rh4AaABAg,현존하는 유일한 축신이자 축구 그 자체인 제시 더 풋볼 린가드....,5,X5TL8aO32Iw
UgyBi_3eGIHPHtBSShB4AaABAg,아니 여기서 더 재밌어질줄 몰랐네 진짜 존나 웃기다,303,sAs4ni1n2OY
Ugwg9aq_B6P1jJh1ysZ4AaABAg,봉호 대전은 언제나 레전드다..,80,sAs4ni1n2OY
Ugw-NlRydmaEZDsoKcJ4AaABAg,지성이형님 버리더니 본인 지성까지 내다버린 상호님 멋지십니다👍,743,sAs4ni1n2OY
UgymGTPAjEV4J09nNfd4AaABAg,피파보면서 사자성어까지 공부할수 있는 이상호 폼 미쳤다,128,sAs4ni1n2OY
UgwM1FWpF2X_9fBuSN54AaABAg,"서로 거울치료해주는
모습 보기 좋구려",27,sAs4ni1n2OY
Ugy_JcrrfSxLecBDyJZ4AaABAg,이 조합은 그냥 벌써 웃기네 ㅋㅋㅋㅋㅋㅋ,85,sAs4ni1n2OY
UgydU6rzNEP9py5SZI54AaABAg,오늘 영상은 평소보다도 더 재밌네 ㅋㅋㅋㅋㅋ,13,sAs4ni1n2OY
Ugw2PX4zzqK1myLkXFp4AaABAg,둘이 걍 침펄토론처럼 되도안한 주제 하나 잡고 노가리까면 재밌을듯,52,sAs4ni1n2OY
Ugxxaa5ceEOYMOhjiMh4AaABAg,캬 사자성어도 잘 알고 여자친구도 이쁘고 피파도 잘하고 지성이형 버린 상호 폼 미쳤다 진짜,223,sAs4ni1n2OY
UgygFjmndwmSBXHymJZ4AaABAg,"확실히 컨셉이 아니고 진짜 무식한거라
진심으로 웃기다.",7,sAs4ni1n2OY
Ugz9KSr4a6u4ixH5DKV4AaABAg,오랜만에 꾸상호 조합 너무 좋다 ㅋㅋㅋㅋㅋㅋㅋㅋㅋㅋㅋ,153,Q5iYP3hHU5U
UgxZiJ3zNqK_a45weK14AaABAg,원더뽀인데 자꾸 올드뽀이~~~이러는거 전나웃기넼ㅋㅋㅋ 당황하는 땅호리도 개웃겨,14,Q5iYP3hHU5U
Ugzqjy8OhSZScUaWAgx4AaABAg,이상호 롤도 잘해 피파도 잘해 연애도 잘해 얼굴도 잘생겼어 성격도 좋아 박지성안써 뭐하나 빠지는게 없넹,1385,Q5iYP3hHU5U
UgwGneB3y5hh2b98Rvh4AaABAg,꾸티뉴랑 상호 조합 너무 재밌다 ㅋㅋㅋㅋㅋㅋㅋㅋ,20,Q5iYP3hHU5U
UgzT2O1FNAvKcyTyFmh4AaABAg,역시 꾸티뉴는 누구랑 해도 꿀조합 ㅋㅋㅋㅋ,75,Q5iYP3hHU5U
UgwG4bVrzCJUMqqIt0x4AaABAg,서로 티키타카 개웃기네 진짜 ㅋㅋㅋㅋㅌㅋㅋㅌㅋㅋㅋㅋㅋㅋㅋㅋㅋㅋ,2,Q5iYP3hHU5U
UgyvlnBgAXuvUj_2x5R4AaABAg,8:29부터 존나웃기네ㅋㅋㅋㅋ,187,Q5iYP3hHU5U
UgxPDNtAlTNqEyEmooN4AaABAg,근데 상호 성격은 진짜 좋다 ㅋㅋㅋ 방송인이네 ㄹㅇ,7,Q5iYP3hHU5U
UgzNpUGGO85HoZREOe94AaABAg,편집 개웃기네 진짜 ㅋㅋ 꾸현우떄 브금이랑 마지막 아웃트로 개좋았다 ㅋㅋ,31,Q5iYP3hHU5U
Ugy8Gi2GrKFocGuzAld4AaABAg,진짜 전철에서 끅끅 거리면서봄,2,Q5iYP3hHU5U
Ugz1HO4QhIwMBfKU47F4AaABAg,봉훈이형 아픈데도 진짜 열심히 말하면서 재밌게 하려고 하는게 보여서 마음아프다,1151,xTgdJl9WnMw
UgwB8XBBPEXzUodnfAV4AaABAg,진짜 상호형 방송식 표정변화가 ㅈㄴ웃기네 ㅋㅋㅋㅋ,66,xTgdJl9WnMw
UgxmLSNusP5LzUFpAFJ4AaABAg,"점수 가려서 스포 방지 너무 좋고
편집자님 나이따~~",174,xTgdJl9WnMw
UgzMf_2sjF3Lrf2BR1d4AaABAg,이두명 캐미가 진짜다ㅋㅋㅋㅋㅋ,34,xTgdJl9WnMw
UgyxsfTz23PdRFhc-1p4AaABAg,목감기 걸려서 컨디션 안 좋아도 드리블이랑 실력은 안 죽네 역시 봉맨,11,xTgdJl9WnMw
UgzIYpSsCt7BxH6NEUF4AaABAg,인트로 보고 있는데 상호가 2ㄷ떡으로 지고 있는데 골 넣었다고 리액션은 야무지게 하네 ㅋㅋㅋㅋㅋ,56,xTgdJl9WnMw
UgwqfjOfXkZn3FrZwA94AaABAg,시작할 때 벌레~~~컷 하는데 우측에 '이상호 0 vs 2 유봉훈' 이게 존나 웃기네 ㅋㅋㅋㅋㅋㅋㅋㅋ,211,xTgdJl9WnMw
Ugy8jmiKlEC6KmNpUSV4AaABAg,"상호형 이젠 스포티비에서도 자막이랑 나레이션 ""The ZD"" 라고 자막 붙이던데 ㅋㅌㅋㅋㅋㅋㅋㅋㅋㅌㅌㅋㅋ 상호형 폼 미쳤고",4,xTgdJl9WnMw
UgyERfI1UZi6XFKe2bd4AaABAg,이젠 썸네일에 봉훈이형 얼굴만 보여도 웃으면서 들어옴 ㅋㅋㅋㅋ,17,xTgdJl9WnMw
Ugx0-JtFbzL19_UiWEx4AaABAg,막판 이기고 나서 앞에 두판 쳐발린거 기억삭제하고 최근전적 일 대 ~ 영 하는거 개웃기네 ㅋㅋㅋㅋ,86,xTgdJl9WnMw
UgzfAy6LWYG4F8H4bO54AaABAg,상호야 너는 실력은 좋은데 팀이 안좋은 거 같아..,1686,2YSL8d56ll0
Ugz048RfuW2TQulyHql4AaABAg,진짜 스토리 전개 너무 맘에 든다 ㅋㅋㅋㅋㅋ감컴퍼니(창연)이 상컴(봉훈•상호) 개바르고 결국 상컴 내전으로 이어지는 ㅋㅋㅋㅋ 아 너무 좋고,21,2YSL8d56ll0
UgwFhYJfzinVtX4d1x54AaABAg,원창연 공경 안돌려서 항상 챌에서 놀아서 실력죽은줄아랐는데 국대 잡는거보니 확실히 클라스가있음,211,2YSL8d56ll0
UgztaaT9BcHgqAJt_Xt4AaABAg,16:44 기껏 도와줬더니 은혜를 원수로 갚는 상호 클라스,391,2YSL8d56ll0
Ugx1KzbOh3IvOSJUnZt4AaABAg,"개인적으로 피파 대결 젤 재밌는 조합 
이상호vs김민교 이상호vs원창연 이렇게가 젤 재밌는듯 ㅋㅋㅋㅋ 민교형이랑 디코 하면서 하는거 오랜만에 올려주세요 요새 채팅으로만 하던데 ㅠ",42,2YSL8d56ll0
UgzNKzBidN4PSauHBqB4AaABAg,원창연+감스트 케미 이기려면 멀었지.. 이상호+유봉훈 케미 좀더 쌓아야 할듯 ㅋㅋㅋ,11,2YSL8d56ll0
Ugz3R5JNH-mhyS4k6ft4AaABAg,진짜 썸네일 레전드다 ㅋㅋㅋ 얼굴을 알아보기 힘든 4명이 모였다..,11,2YSL8d56ll0
Ugy_niAVEUl44fzwbz54AaABAg,2:19 이길수 없어서 도망간거 레전드네 ㅋㅋㅋㅋㅋㅋ,87,2YSL8d56ll0
UgzPo5gKKE1cZBk4rwl4AaABAg,수준모르고 자부심만있는 상호 털리니 속이 시원하다ㅋㅋㅋㅋ,37,2YSL8d56ll0
UgxeFBU74fZlZOoBVZt4AaABAg,유튭 제목만으로도 가슴이 웅장해진다,21,2YSL8d56ll0
UgwFmXMpd2tVr-hWUjJ4AaABAg,ㅇㅅㅇㅅㅎ,401,xTgHegVeKOM
