comment_id,comment,likeCount,video_id
Ugz52_N0d5tnBGlOoCB4AaABAg,굽이랑 친선전 할때 APM 600까지 올라간거 진짜 존나웃겼음,6,MoTYUJsMNRE
UgxjYV5EBZHSaGOh4xJ4AaABAg,랄로 진짜 왤캐 재밌냐ㅋㅋㅋㅋㅋ,15,MoTYUJsMNRE
UgzhfiivkLpkJpgz_jd4AaABAg,팔을 내주고 머리를 가져가는모습 정말 멋있네 김찬호,1,MoTYUJsMNRE
UgxZ3MMjl5LKg7qRVSp4AaABAg,1년전이 아닌 1시간전일걸 보고 제가 살아있음에 감사함을 느낍니다,3517,eYgG78rY1tw
Ugx7b45iBU6uxmt4oNN4AaABAg,랄투브 없으면 잠이 안 오니까 분할로 나눠서 봐야겠다 편집자야 40분 고맙다~,26,eYgG78rY1tw
UgwOESkN3WCANcqfbAx4AaABAg,랄로 철권이 진짜 존나 재밌는데 좀 많이 해줘 ㅠㅠ,25,eYgG78rY1tw
Ugwr1bVj1n2PZ7eP3394AaABAg,"편집자형님 랄로 말사이에 공백 끊었던 편집 없어지고 원래대로 돌아오니까 영상 듣기 편하고 너무 좋아요 감사합니다
ㅜ",4,eYgG78rY1tw
UgzjwJDwFLkbxMPzV0N4AaABAg,"매라운드 무지성 컷킥 스타트에
1라운드는 무조건 적에게 헌납하는 레전드 핸디캡을 주고도 승급을 따내는 남자..
김 찬 호",11,eYgG78rY1tw
UgwwHiiRHE9t_VDzKEF4AaABAg,너무 행복하다 매일 과거 영상 반복해서 보던 나였지만 이렇게 새로운 영상을 접하게 돼서 좋네요 자주 좀 올려줘요 찬호씨.. 시청자들 서운하지않게 ..,8,eYgG78rY1tw
UgxEvdydBK8GTmqZ11l4AaABAg,진짜 철권이란게 심리전이 장난이 아니네요,4,eYgG78rY1tw
UgykPTBERDvFPrXvTu14AaABAg,시험과목 복습보다 먼저인 랄선생님 복습... 낭만이 넘친달까?,6,eYgG78rY1tw
UgxnOeMsDr3mWG6ULUh4AaABAg,40분 내내 미소가 가시질 않았다.,3,eYgG78rY1tw
Ugwp1hDRZJlAo4rE5lp4AaABAg,어떻게 40분동안 이렇게 입담으로 존나 재밌게 하냐 진짜 ㅋㅋㅋ,5,eYgG78rY1tw
UgzLeNy5ee6dgB-qIdR4AaABAg,어떻게 벙커링 모음집만으로도 사람을 웃길까 그는 방송천재 그 자체다,150,CtwrBaCJmCA
Ugxqk9tq8zSAG3shTuJ4AaABAg,랄로가 한달연속으로 방송켜주면 진짜 소원이 없겠다,24,CtwrBaCJmCA
UgzEkF5glDhALer9N_h4AaABAg,스타가 아직까지도 하게된다는게 진짜 레전드인것 같음. 게임을 너무 잘만들었어,36,CtwrBaCJmCA
UgwjwH8Mar28QKaPKtl4AaABAg,"랄로님 스타영상 재밌어요,,, 롤도 좋지만 가끔 이렇게 스1도 올려주세요,,,,,",20,CtwrBaCJmCA
UgzawM7v5oQPHLFtO1V4AaABAg,진짜 채팅 치는 거 하나하나랑 엔딩까지 2년 간 랄로 중 가장 재밌었다 ㄹㅇ,175,CtwrBaCJmCA
UgzIUetJwRXgUXhha7x4AaABAg,스타 잘 모르는 사람이 봐도 ㅈㄴ웃기네 방송천재다 진짜,84,CtwrBaCJmCA
UgyFwMVDuvOjdaL1C4x4AaABAg,마지막 판은 진짜 예술이다....,81,CtwrBaCJmCA
UgzxKoY54ntJfs5IxS54AaABAg,랄선생님이 유행을 따라간다는게 신기방기하네여,0,CtwrBaCJmCA
Ugy257940on9DN40iGR4AaABAg,진짜 썸네일 예술이네ㅋㅋㅋㅋㅋㅋㅋㅋㅋㅋㅋㅋㅋㅋㅋㅋㅋ 감탄이 절로나온다,25,CtwrBaCJmCA
Ugx790hkwbNKkjhuHyp4AaABAg,랄로 맨날 스타하고 철권하고 톡톡톡하고 시프 시뮬레이터만 하면 좋겠다,8,CtwrBaCJmCA
UgxBnYyZ2_xN3UPOF5x4AaABAg,"몇달 전만 해도 지구 숏을 외치던 사나이가 이렇게 밝고 활기찬 먹방하는 거 보니...
쩦,, 이 시대의 낭만 다 뒤졌다,,",3425,_scPv96sod4
UgwdgOJWi6DvfCUFV-t4AaABAg,힘든 하루였는데 형 덕에 웃을 수 있는 것 같아 찬호형 방송 더 자주 해줘!,372,_scPv96sod4
Ugw7zFitxKJNwEgjvXV4AaABAg,랄로님 항상 방송 잘보고 있습니다. 오늘도 바쁘게 살아가는 사람들을 위해 재밌는 방송을 해주시면서 사람들의 스트레스를 풀어주셔서 너무 감사합니다. 방송 볼때마다 코인하느라 바쁘셔서 건강도 안좋아 보이시고 항상 힘들어 보이시는데 오늘은 평소 드시고 싶으셨던거 먹방도 하시고 즐겁게 즐기며 방송하시는 모습을 보니 저도 마음이 편안해지네요^^,240,_scPv96sod4
UgzZ-ySucEEhz4D7Ltp4AaABAg,돈은 버려도 시청자는 버리지 않는 랄선생..,424,_scPv96sod4
UgyK2shzdIHLa1A69zZ4AaABAg,어떻게든 10분 채워야하는 편집자님 화이팅입니다,1113,_scPv96sod4
UgwGhSaZoI6GQ1yUkcN4AaABAg,누구 먹방을 봤길래 뜬금없이 들떠가지고 주문해서 먹을 생각을 한거야 귀엽네 진짜ㅋㅋㅋㅋㅋㅋㅋ,161,_scPv96sod4
UgzQpauFsI2_1o6Z2Fp4AaABAg,고맙다 찬호야 니 덕에 이 각박한 세상에 웃는다,8527,_scPv96sod4
Ugz6_TeSzfph04tzbj54AaABAg,정말 오랜만에 마루쐬를 봐서 좋았읍니다 이렇게 종종 마루쒜를 보여주는 방송 자주 켜주시면 감싸하겠읍니다,368,_scPv96sod4
UgweOs-_XcfkxYzGkKt4AaABAg,"랄로님 보면서 느낀게 유쾌함이란감정이
정말 큰힘이 되는것 같아요
감사합니다 랄로님",483,_scPv96sod4
UgxMYdHhTkqFxajKcxR4AaABAg,랄로님!! 생방좀 자주켜주세요!!! 진짜이러시면!! 트위치 방송켜고 10시간동안 랄로부랄겁니다!,62,_scPv96sod4
UgzAtIBxISqoeyrnfJJ4AaABAg,아 백화점에 후줄근하게 가서 직원들이 친절하게 해주니깐 치매노인 마냥 어.. 어어.. 이러면서 다 사놓고 집에 와서 방송 킨 담에 자랑하려고 컴퓨터 옆에 놔두고 자랑하는거 보니 진짜 존나 귀엽다 ㅠㅠ ㅋㅋㅋㅋㅋㅋㅋㅋㅋㅋ,5530,_Rq19ThN5sg
UgxO84BAk6g8F4lSW3R4AaABAg,랄로님 롤 방송보다 이런 노가리가 너무 좋다 정말 .. 아무말이라도 좋아 이런 컨텐츠 많이 업뎃해주소,1370,_Rq19ThN5sg
UgyPc3ToGHNhmvTrNjt4AaABAg,"슬프다... 우리를 그렇게 웃겨줬는데 시청자에게 감사하다는 말 듣지 못하다가 구찌 직원의 3세트 연타 감사 소리 듣고
마음이 녹아버린 랄튜브... 이제 당신을 호구 랄튜브라 부를게요",142,_Rq19ThN5sg
UgzgCF2KTVj-Tz9KMu94AaABAg,주눅들어 삐진채 꿍시렁꿍시렁거리는거 너무귀여운거 아니냐구ㅋㅋㅋㅋㅋ,141,_Rq19ThN5sg
Ugzpf8u0RzodP0eraK54AaABAg,항상 뭐 사면 자랑하는데 사람들 반응 구리면 입 삐쭉거리는 찬호 귀여워,411,_Rq19ThN5sg
Ugyi5ESrwxMXmTyN33t4AaABAg,"ㅅㅂ 진짜 창과 방패의 싸움이네 ㅋㅋㅋ

끝까지 칭찬받고 싶은 랄로 vs 끝까지 칭찬안하고 싶은 청자",192,_Rq19ThN5sg
Ugy0Vdfex9vrD4tnnWl4AaABAg,"구찌를 사도 시기심, 질투심이 하나도 생기지 않는 방송 ㅋㅋㅋ",2525,_Rq19ThN5sg
Ugy2DGeXcVa-5d4brNR4AaABAg,아진짜 랄로 말투는 별거 아닌것도 엄청 웃기게 하는 재주가 있어ㅋㅋㅋㅋ,28,_Rq19ThN5sg
UgwAXXJTxt6JiCBGczB4AaABAg,트위치 반응이 못믿겨 유튜브의 도움을 받아보려는 호씨...,1667,_Rq19ThN5sg
UgyJb6CRSJPUtxfoBB94AaABAg,유입 들어올때 물 젓는다고 요새 편집도 재밌고 썸네일도 너무 잘만들어서 안들어 올 수가 없음 영상 주기도 솔직히 좀 안달나게 해줘서 더 들어오게 되는것같음 ㅋㅋ 건강 잘 유지하고 앞으로도 방송 잘 이어나가자 김찬호!!! 집자도 너무 고마워요!!,42,_Rq19ThN5sg
UgzHxQccHPuqAwmHR7J4AaABAg,"랄로 방송을 매일 3시간씩 본지 어느덧 26일째… 웃겨하는 감정과 설레하는 감정이 혼동이 되기 시작한다.. 아이돌을 볼 때의 설렘이 94년생 김찬호를 보며 느껴지고 있다.. 사람이 귀여워보이면 진짜 사랑이라고 하던데,. 나 자신을 부정하고 싶어진다..",74,ic7ctNTwQiM
UgypJsL46rs7es7W2ux4AaABAg,랄로를 안지 얼마 안됐는데... 영상을 다보고 새로운 영상을 기다리게 됐다.... 랄로없이는 살 수 없는몸이 되어버렸다,492,ic7ctNTwQiM
Ugxzn3yx03a3gpVD7px4AaABAg,오늘 영상을 보면서 딴 방송인이었으면 유튭각이 아닌 것을 이 녀석의 편집자여서 내보내는 장면도 있는걸 보고 눈물을 흘렸습니다ㅠ,54,ic7ctNTwQiM
UgyE0H2DgtHCeIgEtRh4AaABAg,마루야~~생일 축하하고 앞으로는 랄로 말  잘듣고 행복하게 오래오래 방송해야 한다~~~,363,ic7ctNTwQiM
Ugz4uEdSpsozYKNDZS94AaABAg,"하루만에 조회수 100만... 존나 사랑하고 존나 멋있다 랄로ㅜ행님
존경합니더",54,ic7ctNTwQiM
Ugx-41ZpXKzRPQZitT94AaABAg,"이렇게 좋은걸 당신들만 보고있었다니,, 늦게 입덕했습니다. 랄로씨 진짜 재밌네요 ㅋㅋㅋㅋㅋㅋ",291,ic7ctNTwQiM
UgxGiMi-6PKSU79y-cl4AaABAg,게임 말고 그냥 이런 노가리만 까자 계속 랄로형,10,ic7ctNTwQiM
UgwwbJefHN4XuiWsk0d4AaABAg,물량조절하면서 시청자 조련하는 인방계 에르메스 ㅋㅋ,3012,ic7ctNTwQiM
UgzTeWfUM-bFqBIDTr54AaABAg,랄로야 나도 오늘 생일인데 이런 큰 거근을 선물로 주다니…고맙다 늘 방송이 먼저다 알겠지? 방송 조심하자,7,ic7ctNTwQiM
UgwNx9c4vT7DM63TqE14AaABAg,게임 인기 급상승 영상 1위네 역시 찬호씨 그는 도대체...,381,ic7ctNTwQiM
UgxBSJJx5kRvvH0K18x4AaABAg,"삼성 오디세이 네오 G4 모니터 증정 이벤트에 많은 참여 부탁 드립니다!
https://forms.gle/G3RQikGZ6wWEjh8H8",38,qiwOw9ZzzX4
Ugwmf99n2cpfHJKM39p4AaABAg,팬들이 좀 마음 편하게먹고 선수들도 좋은결과 내기를 응원합니다,112,qiwOw9ZzzX4
Ugwn6UYszkR7HCuxZeR4AaABAg,기다리고 있었어요ㅠㅜㅠㅠㅠ MSI도 기대돼요! 10꽉이라니ㅠㅠ 목 관리 잘 하시고 좋은 해설 잘 부탁드립니다!!,45,qiwOw9ZzzX4
UgwiHrt_P39OOpG4Qz54AaABAg,누가 우승하든 모든 선수들 후회없는 좋은 경기 보여줬으면 좋겠네요,16,qiwOw9ZzzX4
Ugxt9OVqXd8TtRj3A3J4AaABAg,결승전 끝나고 너모 보고싶었음. 저녁이 너무 밋밋해서 msi가 가뭄을 적셔주는 비같음..ㅋ 이번에도 즐겁게 해주오 울프!,5,qiwOw9ZzzX4
UgxDwKIWnrCevD9lORd4AaABAg,므시 시간대가 너무 좋음ㅋㅋㅋ작년엔 이른 아침에해서 거의 못봤는데 이번엔 거의다 밤8~12시 개꿀,6,qiwOw9ZzzX4
Ugz7d9PW2LxsEl7a1n14AaABAg,이미 전설과 함께해오고 있다는 이유만으로도 영광임..내 세대에 격은거만으로도 감사,1,qiwOw9ZzzX4
Ugz1SS1SB2ZQn8ehWYt4AaABAg,"울프님 거의 알리스타에서 브라움이 되셨네요 ㄷㄷ 
개인적으로 10꽉 영상 기다려지네요ㅎㅎ 울튜부화이팅!",1,qiwOw9ZzzX4
UgykLoooDEWrfW5KaQ14AaABAg,울태식이 진짜 돌아왔구나!! 한달동안 뭐하지 뭐하지 하더니 ㅠㅠ 고맙다 진짜,3,qiwOw9ZzzX4
UgxOib1IbARRK1wBJ7d4AaABAg,컨텐츠 너무 잘 만드신거 같아욧! 진짜 재밌게 보고 있어요!,0,qiwOw9ZzzX4
UgwGLqXbO12fD39VSDV4AaABAg,"🎬풀경기 영상은 여기로
https://youtu.be/i8wzU9jgN8w",8,2rl1ytMvgPs
Ugzg1I8zKRHCcdukyOV4AaABAg,울프 돌릴생각에 신나서 웃는거 봐 ㅋㅋㅋㅋ,138,2rl1ytMvgPs
UgxF5csc8_encFfnZOV4AaABAg,자막 ㅋㅋㅋㅋ 저 GOAT 눈 웃는거봐 ㅋㅋㅋㅋ,92,2rl1ytMvgPs
UgynotjMimjKoBKrRfd4AaABAg,아 다시봐도 저건 진짜ㅋㅋㅋㅋ 언제나 전맴버 사랑 여전한...,21,2rl1ytMvgPs
UgwAO87-k4jh4k2a0CN4AaABAg,ㅋㅋㅋㅋㅋㅋㅋㅋㅋㅋㅋㅋㅋㅋㅋㅋㅋㅋㅋㅋㅋㅋㅋㅋㅋㅋㅋㅋㅋㅋㅋㅋ이건 지금 봐도 재밌네,43,2rl1ytMvgPs
UgxrRfQ9ZsqxfwXSBE54AaABAg,"울프 고로시생각에신난 페이커
유툽각에 신난 울프
윈윈이 아닐까",22,2rl1ytMvgPs
Ugz8wziiIEXaFYkT1qV4AaABAg,울프는 유튭각을 위해서라도 페이커한테 겜알못 이라고 욕먹고 싶다,4,2rl1ytMvgPs
UgwfaiG3Sm6DXM5qrj54AaABAg,ㅋㅋㅋㅋㅋㅋㅋㅋ심한말 ㅋㅋㅋㅋㅋㅋ,0,2rl1ytMvgPs
Ugym_Fjo3tToqHctOHp4AaABAg,야리야리 잘 돌리네 ㅋㅋ,3,2rl1ytMvgPs
Ugx69dxbSirOgRMxzfd4AaABAg,저 GOAT 자막 ㅋㅋㅋㅋ,3,2rl1ytMvgPs
Ugw9EcoA9bNxW0dMPzh4AaABAg,"🎬풀경기 영상은 여기로
https://youtu.be/6Gny-_ZrXGY",18,F-SJAdFgi8w
UgyYUHJTKu21DnbQdUF4AaABAg,그 댓글 생각난다. 개자식아라고 울부짖지만 달달한 유튭각 생각에 입꼬리 올라간 울프라면 개추 ㅋㅋ,176,F-SJAdFgi8w
UgxjfHB_h3TylZVVKsB4AaABAg,울튜브 비시즌 동안 쇼츠로 정상영업합니다...,58,F-SJAdFgi8w
Ugyu43nl0FcQD4tZHAd4AaABAg,하지만 이날 1000원 펀치 엄청 터져서 개이득 봤던 이재완이죠?ㅋㅋㅋㅋㅋ,18,F-SJAdFgi8w
UgywtU8EUnxZupst_Dd4AaABAg,*'쇼크웨이브 발사대'*,37,F-SJAdFgi8w
Ugx6GMQzcwPY9AMOWfN4AaABAg,솔직히 좋았잖아...❤,16,F-SJAdFgi8w
UgyqLpA9WRcloOH9VaV4AaABAg,저때 울프가 페이커 칭찬하고 있었음 ㅋㅋㅋ,3,F-SJAdFgi8w
UgwInvAqNUC6NHUpl314AaABAg,"생방으로 본 나, 칭찬해 ❤",14,F-SJAdFgi8w
UgwxTpx6gEnjMS6_0994AaABAg,"""쇼크웨이브 발사대 겜알못""",1,F-SJAdFgi8w
UgwybMRiOeZbWmC_Ctl4AaABAg,"""페이커친구1"" ""페이커서폿""
(실제로 들은말)",13,F-SJAdFgi8w
UgwyDfEYHHCOTRTNO6t4AaABAg,"🎬풀경기 영상은 여기로
https://youtu.be/n3l_-doIdpE",8,drDk3sL3tLQ
UgzwvlHlAQdZHlyxct94AaABAg,와우 딱 시즌 끝나고 이런 쇼츠를 원했는데 바로 해주시는 킹갓 편집자님! 감사합니다.,30,drDk3sL3tLQ
UgxvMGslcZ23CPhELAF4AaABAg,젠붕이가 지금은 허허하면서 웃어넘기는데 저때는 진짜 기분이 그랬죠.. ㅋㅋ,44,drDk3sL3tLQ
UgybT3XRx1OD4KA8Vgt4AaABAg,아 진짜 이거 보면서 기겁했는데ㅋㅋㅋ 명장면이죠,0,drDk3sL3tLQ
UgyrX8NOoYNUoh20tIh4AaABAg,"울프 첫번째 쇼츠가 광동전이라니 ㅋㅋㅋㅋㅋ
Kt전 그 광란의 울프 반응 기원",11,drDk3sL3tLQ
UgyIgQzAr0pqJt5lkHp4AaABAg,진짜 lck때 유일하게 t1보다 더 응원한팀 광프동릭스는 낭만이 있다,3,drDk3sL3tLQ
UgxtoTCu7SV6D90XbRl4AaABAg,"MSI 동시중계에 혹시 울프
중계되나 하며 싱글벙글
웃으며 놀러왔는데 쇼츠까지
키야 기분이 2배로 좋아진다고~",2,drDk3sL3tLQ
UgwsNQEegRTzx-ppEw14AaABAg,"근데 이거 울프 롤알못이라고 하기도 좀 그런게
정상적이였으면 절대 스틸 안당할 상황이였는데
갑자기 피넛이 벽넘어서 강타못쓰는 상황이 될줄 어떤 전문가도 예상못함 ㅋㅋㅋㅋㅋㅋ",23,drDk3sL3tLQ
Ugw_j3vEYokC8ClsJXV4AaABAg,오 결승전 이후로 lck 영상 다 관심없음 누르고 살았는데 ㅋㅋㅋㅋㅋㅋㅋㅋ 오랜만이네,24,drDk3sL3tLQ
UgwLH7q6Bs3UFV2oSNd4AaABAg,ㅋㅋㅋㅋ 드디어 쇼츠?! 아 좋다,0,drDk3sL3tLQ
Ugyrchl0sNRzyRwgPQR4AaABAg,"페이즈에 묻혀서 비교적 많은 주목을 못받았지만 딜라이트 진짜 수고했다...티원 선수들도 수고했고 젠지 선수들 당연히 수고했고 젠지  2023 LCK SPRING 동안 모든 선수,코치,팬분들 수고하셨습니다!
젠지 꺾이지않고 계속 응원한보람 있다",665,wmlne6Pg8i8
UgzG7TzPDdVNd-piIGl4AaABAg,"Mvp는 페이즈가 받았지만 1 2경기 도라가스보고 진짜 미쳤다는 말 밖에 안나왔다...
티원 준우승 아쉽지만 젠지가 결승만큼은 너무 잘했네...",38,wmlne6Pg8i8
Ugzlv9tKYKqY2DWA8214AaABAg,"울프, 울집자, 울청자 이번 스프링도 너무너무 고생 많았어요. 마지막에 우리 선수들이 환하게 웃지 못해서 솔직히 아쉽고 속상하기도 하지만 이번 경험이 더 큰 무대를 위한 발판이 되길 바라요!
MSI 전까지 남은 시간동안 그동안 못했던 것들도 하고, 푹 쉬면서 다시 열심히 달릴 준비 잘 해보자구요.
울프 이번 스프링도 너무 고마웠어!!! 남은 2023년도 건강하고 행복하게 중계해줘잉~",37,wmlne6Pg8i8
UgxkAUqMb7BppHeUJIt4AaABAg,"결과 나오고 수상하는부분까지 계속 진행해주셔서 감사합니다.
2023 스프링 울챔스 라이브 많이 봤는데 서머에도 잘 부탁드립니다.
항상 건강하시고 오늘도 좋은 하루 되세요!",3,wmlne6Pg8i8
UgwshrsUgNcUjIDRaKZ4AaABAg,젠지팬인데 늘 타팀 리스펙해주시는 울프님 해설 항상 자주 보고있습니다. 티원분들 모두 수고많으셨고 같이 MSI 화이팅입니다.,21,wmlne6Pg8i8
Ugw5bN5Yvb2fOX8wKLl4AaABAg,페이즈의 엄청난 딜링력과 쵸비의 메이킹 때문에 좀 묻히긴 했지만… 딜라이트님이 진짜 서포터 그 자체였네요 정말 재미있는 결승전이었습니다,12,wmlne6Pg8i8
UgxGV44dFpVF6TaAQnl4AaABAg,1:41:29 1:42:03 영상 볼때도 느꼈지만 저런 마인드는 진짜 게이머라는 직업을 떠나서 사람으로서도 ㄹㅇ 본받을 마인드 같다. 아무리 어렵더라도 '그래도 할 수 있다'라는 긍정적인 멘탈이 너무 멋진듯.,200,wmlne6Pg8i8
UgyIzzfPhy8zLR5NjPd4AaABAg,"울프님 이번 스프링부터 롤을 보기 시작했는데 울프님 덕분에 어려워도 재밌게 볼 수 있었던 것 같아요 정말 감사합니다!!
열심히 달려오신 만큼 msi까지 푹 쉬시고 다시 재밌는 중계 부탁드릴께요🙇‍♀
티원팬이라 준우승이 아쉽긴 하지만 젠지도 좋아하는 팀이고 잘해서 정말 대단하다고 느꼈습니다! 우승 축하드립니다><
티원 제오페구케 선수들 정말 고생 많았고 다음에도 좋은 모습 보여주시길 바랍니다. 항상 응원합니당!! ❤",1,wmlne6Pg8i8
UgzAbuhZvH3zfEcOH0R4AaABAg,평소 약점이라 불리던 탑과 밧텀 라인전이 완벽했음을 넘어 티원을 압도해 엄청난 경기를 볼 수 있었음. 룰러 리헨즈 나가고 작년 썸머만큼은 아니지만 성장하는 모습을 보고 싶었는데 그 이상 보여줘서 기뻣음. 그동안 고생한 만큼 푹 쉬고 두팀다 msi에 멋진 모습을 보여주길,5,wmlne6Pg8i8
UgzlZw5qfPXdHyoeml14AaABAg,"정말 우리 티원 선수들이 많은 노력을 해왔다는 것은 과정에서 뼈저리게 알았는데 4번 연속 결승에서 아쉬운 결과가 나오니 조금 슬프다..
젠지 선수들도 이번에 팀원이 바뀌었는데도 정말 멋진 경기력 대단했고..",2,wmlne6Pg8i8
Ugwl5At6dgMgDm070n14AaABAg,"안녕하세요 울튜브 편집자입니다!
본 경기 영상은 9일 진행될 결승전 편집에 집중하기 위해 평소의 울튜브 편집 방식이 아닌 
자막과 컷편집 위주의 비교적 간단한 편집으로 이루어진 점을 양해 부탁드립니다.
곧 있을 오후 3시의 결승전 중계와 이후 편집 영상 모두 많은 관심과 시청 바랍니다. 감사합니다!",593,7aGqMBaCPNI
UgyvHMSyNG2I9dUnbMt4AaABAg,아무리 편집을 간소화시켜도 불과 몇시간만에 이 퀄리티는 말이 안되는데 ㄷㄷ,300,7aGqMBaCPNI
Ugw2bhoyBpZEBA6_KuF4AaABAg,최고의 명품조연이 된 티원.. 하..,79,7aGqMBaCPNI
Ugx_E4wT1ug-fSa98CB4AaABAg,결승전 편집에 집중한다 하셨으니 퀄리티가 더 기대되네요 ! 빨리 결승 올라왔으면 좋겠어요 :),35,7aGqMBaCPNI
UgwS-fEUk01wghxH3LB4AaABAg,속도 미쳤다 결승전에 보여주셔서 감사합니다,1,7aGqMBaCPNI
UgzNqQhYW-SAwhOWJK54AaABAg,편집속도 미쳤다 결승 직관 가는 길에 맛있게 보겠습니다ㅋㅋㅋ티원 V11 화이팅,91,7aGqMBaCPNI
UgzxLfO9gZ1iCGhSPpN4AaABAg,진짜 3세트는 딜라이트의 침착한 그랩이 다한듯..천천히 역전각을 보고나서 빠르게 스노우볼 굴리는게 ㄹㅇ볼때마다 소름돋음;;,33,7aGqMBaCPNI
Ugz439nfc5XF9MAqJ9t4AaABAg,울프님 해설들으면서 보니까 롤초보도 이해가 잘되고 더 재밌게 볼수있슴다 ㅠㅠ 최고에여,2,7aGqMBaCPNI
Ugy0hqKaEUMaQeBWtTt4AaABAg,"울프님 영상은 처음보는데 편집 되게 맛있게 하시네요 
하이라이트 장면 집중되게 편집하는것도 좋고 울프님 발언이 어떤 근거인지 장면과 자막이 동반되니 이해하기 더욱 쉽고 좋네요.. 
처음 들럿는데 자주 올게요",1,7aGqMBaCPNI
UgzchkFluFuo3I_wAZ94AaABAg,모두 굿모닝입니다~ 바로 올려주시는 울집자님 폼 미쳤다...고맙습니다!,81,7aGqMBaCPNI
UgzeWRssqn0LqKV-olh4AaABAg,분명 이긴팀인데 디스박히는게 가장 꿀잼이었던 경기,359,oqGiYORySsE
UgykRvdChnOM_e5LX9x4AaABAg,사실상 모든 경기에서 프로 원딜이 해줘야하는 1인분은 항상 해주신 박도현 선생님...크흐흑,139,oqGiYORySsE
UgwggPWPwEl9ZpRnUJd4AaABAg,진짜 바이퍼 고군분투 하는것도 안타까웠는데 경기끝나고 그리핀 바텀듀오 포옹하는거 보고 한숨나오더라ㅋㅋㅋ 둘다 엄청 열심히 했는데 한명은 승자 입장에서 한명은 패자입장에서 만남 ㅠㅠ,12,oqGiYORySsE
UgyJMRT5b56drrqOUQ14AaABAg,추천 영상에 떠서 우연히 봤는데 디테일 하고 보기 편하게 슬로우랑 표시까지 울집자님 감사합니다😊,7,oqGiYORySsE
Ugy89WeT5K3zCRV8WXZ4AaABAg,크 울프의 분석력에 놀랍니다. 점멸 계산 하는거 소름,0,oqGiYORySsE
UgwKUrh2F0bFRgwEJop4AaABAg,울집자님 그리고 울프님 늘 멋진 영상과 좋은 컨텐츠 감사합니다😘😘,17,oqGiYORySsE
Ugy2libRCS2apHGF_rJ4AaABAg,진짜 울프 석나가는게 개꿀잼이었는데 ㅋㅋㅋㅋㅋ,155,oqGiYORySsE
UgzIeC_RyguvPcLafjJ4AaABAg,"한화가 생각한 것보다 더못해서 놀랐음 ㅋㅋㅋㅋㅋㅋㅋㅋㅋㅋ 

바이퍼가 진짜 빠따들고 나머지 두들겨패도 할말 없어야함.",417,oqGiYORySsE
Ugz2ffDqcYesCUA4bzB4AaABAg,솔직히 이번 경기(영상)는 울프가 리헨즈 선수를 얼마나 좋아하는지 알 수 있었음 ㅋㅋㅋ,154,oqGiYORySsE
UgwAK3KtSLpt092Ky0R4AaABAg,봉풀주 원래 꽤 쓰긴했었는데 최근 t1사기단이 투강타들고 그냥 문따고 들어가서 바론훔쳐서 나오는 장면 때문인지는 몰라도 봉풀주 사용률이 더 올라간듯 ㅋㅋㅋㅋㅋ,52,oqGiYORySsE
UgxIGrFaHM53c3gqU-p4AaABAg,"롤 보는건 좋아하지만 롤을 잘 모르는 롤린이인데요, 생방으로 울프님이 설명하는거 실시간으로 봐도 당시엔 잘 이해못하는데 울집자님 친절한 시뮬레이션+자막설명 때문에 영상 꼭 다시찾아보고 있어요! 항상 롤알못에게도 상냥한 영상 만들어주셔서 감사합니다😊
건강하시고 울프돈 많이많이 가져가세요!!",334,o_4TeJLwa60
UgyDpatJb6z8LapgeT14AaABAg,"35:46 4세트
올해 정말 쭉쭉 상승할 것 같은T1. 
이 다섯명이 한 팀인게 이제 너무 익숙하고 다섯명이 계속 함께 위로 올라갔으면 한다.우리 혁은.. 요즘 정말 나에게 너무 힘을 주고있어서 너무 고맙고.. 진짜 좋아하는 선수다. 우스,오너,구마유시,케리아 다들 경기때는 멋지고 귀여운모습 보여줄때마다 힐링하는 중. 울프님 관전은 넘 재밌고 꼼꼼히 설명해주셔서 실시간, 다시보기, 유튜브로 보고 유튜브는 계속 돌려봐도 시간가는줄 모르고 다시봐진다. 울집자님은.. 진짜 능력자.. 진짜 울프님이랑 오래함께해줘요.",325,o_4TeJLwa60
UgwkOx5w9cmsl1vB5xR4AaABAg,"사실 티원 진 경기는 영상 다시 안 보는데 3세트에 페이커 아리  노룩 매혹이 너무 멋져서 이번엔 찾아봤어요...
상혁아 결승진출 msi진출 축하해👍👍 꼭 우승하자!",109,o_4TeJLwa60
Ugyja2zXNcUcfPaRjwV4AaABAg,"플옵 시리즈동안 울프가 매번 대상혁을 외치는건 진짜 귀하다 ㅋㅋㅋㅋㅋ

그만큼 현재까지 보여준 페이커의 모습은 역대급임.

3세트 만약 이겼으면 무조건 페이커 만장일치 POG였을듯",318,o_4TeJLwa60
Ugx_cMPcEkUq0lPCT_14AaABAg,"울프 평소엔 우제잘할때 ""아니우스야~~~!!"" ""우린 우스만 믿고가요~~!!! 다필요없어!!!!!!""   ""그래 넌 그냥 죽어라 괜찮아 우스만 안죽으면돼!"" 
하면서 어화둥둥해주는데 가끔 개망한판 나오면 냉랭해지는게 존나웃김.. 
""지금 나르가 하등 쓸모없거든요?"" 
""사일이 약간..벌레화 돼가고 있기는  해가지고"" 
이 발언 후에 사일러스 속죄의 트리플킬 세탁쇼 한 것도 웃김ㅋㅋㅋ",250,o_4TeJLwa60
UgwQwSEG27a4DJ4AFxR4AaABAg,"LCK라서 경기력을 매번 기대하면서
울프의 실시간 분석과 리액션&드립에 재미를 배로 느끼고
울집자의 알찬 편집, 분석과 관련 디테일 자료로 경기를 편하게 흡수하네요.

매번 최고입니다!",5,o_4TeJLwa60
UgzPdA4xQxnXb8Q28It4AaABAg,"페이커는 유머감각을 팔고 게임실력을 사왔고, 케리아는 인터뷰능력을 팔고 게임실력을 사왔다......",995,o_4TeJLwa60
Ugw6aozsP19spzP-eqZ4AaABAg,"34:00 플돌기 직전 볼 것 같았는데 핵심은 피넛이 라칸과 함께 이니시를 맡아줘야 하는 챔프인데, 스펠 체크 후 오른한테 플e를 하면서 궁쓰는 순간 아펠 뜨는게 핵심 이었네요, 구마유시 입장에서는 e각이 나올 수 없는 상황이기 때문에 피넛이 좋은 플레이를 했네요!",4,o_4TeJLwa60
UgzXAS1HUfqhWbQ0kzJ4AaABAg,The thing about zeus and faker in the third game changing lines in perfect times was something incredible,0,o_4TeJLwa60
UgztFLE4ilUWTWTQg_14AaABAg,그냥 너무 잘한다 T1은 사랑이다.. 너무 사랑해요,1,o_4TeJLwa60
Ugz0yRSBZkK_tTHfnZd4AaABAg,"직접 겜은 못하고 t1 경기만 챙겨본지가 몇년째인데
울프님 영상은 디테일한 부분까지 알려줘서 이해하기 좋아요",199,3sDbwjeico0
UgyyuAkKIChGLCpzgUJ4AaABAg,"1:02:25 이런 디테일 너무 좋아요 
역시 울프+울집자",185,3sDbwjeico0
Ugx9Z3aKkG8JMc_3gFt4AaABAg,"겉으로는 대상혁을 부정하지만 
대상혁 없이는 만족할수없는 몸이 되버린 울프..",631,3sDbwjeico0
Ugz0ZGTlrhdqKyxu6_V4AaABAg,마지막 한타 때 말파이트 심리전 설명 참 좋다. 무작정 도란 까기만 바쁘지 왜 그랬는가에 대한 생각은 안하는 팬들한테 제대로 된 설명인 듯.,267,3sDbwjeico0
UgzSQFRB9wZ9vzc0GiF4AaABAg,"미쳤다 이런 디테일이 숨어있었을줄이야 진짜 프로선수출신이어서 그런가 게임을 보는 각이 남다르네 이 게임이 힘든게임인거는 알았지만 그 사이사이에 들어있는 디테일이 너무 알차고 게임을 더 재밌게 만들어준다,,",10,3sDbwjeico0
UgyU9TDF4v1ElbZ-WE54AaABAg,"아펠리오스 딜 메커니즘 잡아주는 거, 마지막 심리전 설명 너무 좋아요.. 울챔스 끊을 수가 없음.",11,3sDbwjeico0
